id	market	text	weight	userAgent	trueMarket	trafficPriority	urlAugmentation	uiLanguage	uiRegion	judgeMarket	anid	muid	impressionguid	querytext	lat	lng	city	state	country	formcode	formcodename	formcodeisorganic	requesttime	nrtpopulationfreq	historicalpopulationfreq	populationfreq	decile	isoverall	source	logquerylanguage	querylanguagepredictionhumpbackv1	isloglocation	judgemarket	datacenter	querylanguageprediction	superfresh	googletimestampsuperfresh	bingpostwebsuperfresh	constanthead	googletimestampcount	bingnewsanswercount	googlenewsanswercount	freshgoogle365	superfreshgoogle365	googletimestamplessthan365dayscount	googletimestamplessthan7dayscount	implicittemporal	forbvbusage	judgelanguage	querylanguage	intent	results	nrt_query_set_id	nrt_sampling_start_time	truemarket	isseasonalfresh
521b9d2f-451d-4f7e-a2f3-0979b859d326	en-US	[Lat:39.5671997070313][Long:-104.937797546387][Town:SouthGlenn,CO][PostCode:00000][IsGps:true]how migrant was freed charged with	1		en-US	premium		en	US	en-US		16DF85D512EB6E5001D6913213A86F3A	003CE2A97ADE4D1CA9260EB3FE3D8B28	how migrant was freed charged with	39.5671997070313	-104.937797546387	SouthGlenn	CO	United States	s:web:null	Missing form code where vertical is web and referrer is null	0	8/26/2024 12:11:04 AM	-1	0	-1	0	0	1	[{"predictions": {"en": 0.999672, "de": 0.000221, "lb": 7.6e-05, "nl": 2.7e-05, "pt-PT": 1e-06, "pl": 1e-06, "mt": 1e-06}, "text": "how migrant was freed charged with"}]	"en": 0.999672, "de": 0.000221, "lb": 7.6e-05, "nl": 2.7e-05, "pt-PT": 1e-06, "pl": 1e-06, "mt": 1e-06	0	en-US	westus	en: 0.999672, de: 0.000221, lb: 7.6E-05, nl: 2.7E-05, pt-PT: 1E-06, pl: 1E-06, mt: 1E-06	1	1	0	0	8			1	1	8	3	0	1	en	en	This query is likely interested in recent web pages. Please think about if the document is recent enough to be a good match for the user’s needs.	The user likely wants documents that are recent. Please pay attention to dates in the Result page. Assume the query was typed in just now.	f823bc67-7172-40dd-8143-d13e0f9eea04	2024-08-26T12:01:03.0000000+00:00	en-US	0
53b22d02-5ce3-4659-ae71-196c71ffd500	de-DE	[Lat:50.74769973754883][Long:7.119699954986572][Town:Bonn,North Rhine-Westphalia][PostCode:00000][IsGps:true]galaxy watch vs pixel watch 3	1		de-DE	premium		de	DE	de-DE			0040F8CBE1174C19BC4CD80CD41E8154	galaxy watch vs pixel watch 3	50.74769973754883	7.119699954986572	Bonn	North Rhine-Westphalia	Germany	QBRE	top query box onresults page	0	8/26/2024 2:27:22 AM	-1	0	-1	1	0	1	[{"predictions": {"en": 0.982805, "vi": 0.009565, "de": 0.004071, "id": 0.001539, "nl": 0.000537, "fr": 0.000425, "lb": 0.000328, "fi": 0.000162, "es": 9.7e-05, "ms": 9.4e-05}, "text": "galaxy watch vs pixel watch 3"}]	"en": 0.982805, "vi": 0.009565, "de": 0.004071, "id": 0.001539, "nl": 0.000537, "fr": 0.000425, "lb": 0.000328, "fi": 0.000162, "es": 9.7e-05, "ms": 9.4e-05	1	de-DE	northeurope	en: 0.982805, vi: 0.009565, de: 0.004071, id: 0.001539, nl: 0.000537, fr: 0.000425, lb: 0.000328, fi: 0.000162, es: 9.7E-05, ms: 9.4E-05	1	1	0	0	7			1	0	7	2	1	1	de	en	Diese Suchanfrage ist vermutlich an aktuellen Webseiten interessiert. Bitte überlegen Sie, ob das Dokument aktuell genug ist, um die Bedürfnisse des Nutzers zufriedenzustellen.	Der Nutzer möchte vermutlich Dokumente, die aktuell sind. Bitte beachten Sie daher auch die Datumsangaben auf der Ergebnisseite. Gehen Sie davon aus, dass die Suchanfrage soeben erst eingegeben wurde.	f823bc67-7172-40dd-8143-d13e0f9eea04	2024-08-26T12:01:03.0000000+00:00	de-DE	0
562e1076-e9e0-42c4-8558-c2c87817623e	en-US	[Lat:47.670501708984375][Long:-122.12069702148438][Town:Redmond,Washington][PostCode:00000][IsGps:true]ニュース 速報	1		en-US	premium		en	US	en-US			FFAF6EB216404CE8AE56BCC6C4EF0AF0	ニュース 速報	47.670501708984375	-122.12069702148438	Redmond	Washington	United States	QBRE	top query box onresults page	0	8/26/2024 2:35:03 AM	-1	845685	845684	8	1	1	[{"predictions": {"ja": 1.0}, "text": "ニュース 速報"}]	"ja": 1.0	1	en-US	eastus	ja: 1	1	1	0	0	7			1	1	7	7	0	1	en	ja	This query is likely interested in recent web pages. Please think about if the document is recent enough to be a good match for the user’s needs.	The user likely wants documents that are recent. Please pay attention to dates in the Result page. Assume the query was typed in just now.	f823bc67-7172-40dd-8143-d13e0f9eea04	2024-08-26T12:01:03.0000000+00:00	en-US	0
5796295d-2773-4ea6-b042-e5664f3d7d70	en-IN	[Lat:26.7033004760742][Long:81.0136032104492][Town:,][PostCode:00000][IsGps:true]iphone 16 apple eve	1		en-IN	premium		en	IN	en-IN	A53572EDC492499CC68BE502FFFFFFFF	346E788A6D316A8036D36C566C376B63	FFA3A48B65574F06A3ADC569DFEAA344	iphone 16 apple eve	26.7033004760742	81.0136032104492				QBRE	top query box onresults page	0	8/26/2024 1:30:08 AM	-1	0	-1	0	1	1	[{"predictions": {"en": 0.963177, "fr": 0.015773, "tr": 0.008213, "nl": 0.006572, "da": 0.001335, "es": 0.001128, "pt-PT": 0.000729, "nb": 0.00056, "hu": 0.000559, "it": 0.0004}, "text": "iphone 16 apple eve"}]	"en": 0.963177, "fr": 0.015773, "tr": 0.008213, "nl": 0.006572, "da": 0.001335, "es": 0.001128, "pt-PT": 0.000729, "nb": 0.00056, "hu": 0.000559, "it": 0.0004	0	en-IN	koreasouth	en: 0.963177, fr: 0.015773, tr: 0.008213, nl: 0.006572, da: 0.001335, es: 0.001128, pt-PT: 0.000729, nb: 0.00056, hu: 0.000559, it: 0.0004	1	1	1	0	7			1	1	7	4	1	1	en	en	This query is likely interested in recent web pages. Please think about if the document is recent enough to be a good match for the user’s needs.	The user likely wants documents that are recent. Please pay attention to dates in the Result page. Assume the query was typed in just now.	f823bc67-7172-40dd-8143-d13e0f9eea04	2024-08-26T12:01:03.0000000+00:00	en-IN	0
5969eae3-a5cf-4267-8f20-bd5406c698bf	fr-FR	[Lat:45.3983993530273][Long:5.98360013961792][Town:La Buissière,Auvergne-Rhône-Alpes][PostCode:00000][IsGps:true]hawaiis big damage island hone brings	1		fr-FR	premium		en	FR	en-GB			FF7CBAF077E9484D8725415C3FEE8444	hawaiis big damage island hone brings	45.3983993530273	5.98360013961792	La Buissière	Auvergne-Rhône-Alpes	France	s:web:null	Missing form code where vertical is web and referrer is null	0	8/26/2024 2:35:57 AM	-1	0	-1	0	1	1	[{"predictions": {"en": 0.992744, "nl": 0.005057, "af": 0.002061, "fr": 3.6e-05, "sw": 2.9e-05, "lb": 2.8e-05, "da": 1.3e-05, "et": 8e-06, "fil": 6e-06, "lv": 3e-06}, "text": "hawaiis big damage island hone brings"}]	"en": 0.992744, "nl": 0.005057, "af": 0.002061, "fr": 3.6e-05, "sw": 2.9e-05, "lb": 2.8e-05, "da": 1.3e-05, "et": 8e-06, "fil": 6e-06, "lv": 3e-06	0	en-GB	northeurope	en: 0.992744, nl: 0.005057, af: 0.002061, fr: 3.6E-05, sw: 2.9E-05, lb: 2.8E-05, da: 1.3E-05, et: 8E-06, fil: 6E-06, lv: 3E-06	1	1	1	0	9			1	1	9	9	1	1	en	en	This query is likely interested in recent web pages. Please think about if the document is recent enough to be a good match for the user’s needs.	The user likely wants documents that are recent. Please pay attention to dates in the Result page. Assume the query was typed in just now.	f823bc67-7172-40dd-8143-d13e0f9eea04	2024-08-26T12:01:03.0000000+00:00	fr-FR	0
5a4ff166-8a0c-432f-a5a7-56e3c6337e30	it-IT	[Lat:-12.25790023803711][Long:-38.959800720214844][Town:Feira De Santana,Bahia][PostCode:00000][IsGps:true]cure hpv reddit	1		it-IT	premium		pt	IT	pt-BR		0340D1D040AB64E63B34C587414965F2	0A948964EAEF4869B433BCDE40C0E7A9	cure hpv reddit	-12.25790023803711	-38.959800720214844	Feira De Santana	Bahia	Brazil	s:web:null:chrome	FC for Chrome Default Searches	0	8/26/2024 12:15:06 AM	-1	0	-1	1	0	1	[{"predictions": {"en": 0.9838, "ro": 0.005579, "tr": 0.003473, "fr": 0.001758, "nl": 0.001508, "de": 0.001409, "sq": 0.000289, "id": 0.000263, "fi": 0.000262, "vi": 0.000257}, "text": "cure hpv reddit"}]	"en": 0.9838, "ro": 0.005579, "tr": 0.003473, "fr": 0.001758, "nl": 0.001508, "de": 0.001409, "sq": 0.000289, "id": 0.000263, "fi": 0.000262, "vi": 0.000257	1	pt-BR	northeurope	en: 0.9838, ro: 0.005579, tr: 0.003473, fr: 0.001758, nl: 0.001508, de: 0.001409, sq: 0.000289, id: 0.000263, fi: 0.000262, vi: 0.000257	0	0	0	0	8			1	0	6	0	1	1	pt	en	Esta busca é mais provável de estar interessada em páginas web recentes. Por favor pense se o documento/página é recente o suficiente para corresponder as necessidades do usuário.	O usuário é mais provável querer documentos que são mais recentes. Por favor preste atenção as datas na página do resultado. Suponha que a busca foi escrita agora mesmo.	f823bc67-7172-40dd-8143-d13e0f9eea04	2024-08-26T12:01:03.0000000+00:00	it-IT	0
5aecd3ba-fe43-4fd7-afc2-4f76c74224e1	en-US	[Lat:40.842498779296875][Long:-74.48580169677734][Town:Morris Plains,New Jersey][PostCode:00000][IsGps:true]astronauts+stuck+ij+space	1		en-US	premium		en	US	en-US	A6490F108FE59C6BFE11B40AFFFFFFFF	358E0A4A825A6EE42FC31E9D83286FEF	00EEBA918196498493F1E52BB6ABF541	astronauts+stuck+ij+space	40.842498779296875	-74.48580169677734	Morris Plains	New Jersey	United States	QBLH	Homepage Query Box - Flight 0 - Web	0	8/26/2024 1:33:09 AM	-1	0	-1	0	0	1	[{"predictions": {"en": 0.953903, "nl": 0.028792, "de": 0.010118, "sv": 0.002092, "lv": 0.001661, "lb": 0.000958, "fr": 0.000896, "lt": 0.000523, "id": 0.000504, "ms": 9.9e-05}, "text": "astronauts+stuck+ij+space"}]	"en": 0.953903, "nl": 0.028792, "de": 0.010118, "sv": 0.002092, "lv": 0.001661, "lb": 0.000958, "fr": 0.000896, "lt": 0.000523, "id": 0.000504, "ms": 9.9e-05	1	en-US	eastus	en: 0.953903, nl: 0.028792, de: 0.010118, sv: 0.002092, lv: 0.001661, lb: 0.000958, fr: 0.000896, lt: 0.000523, id: 0.000504, ms: 9.9E-05	1	1	1	0	5			1	1	5	5	1	1	en	en	This query is likely interested in recent web pages. Please think about if the document is recent enough to be a good match for the user’s needs.	The user likely wants documents that are recent. Please pay attention to dates in the Result page. Assume the query was typed in just now.	f823bc67-7172-40dd-8143-d13e0f9eea04	2024-08-26T12:01:03.0000000+00:00	en-US	0
5aef8d82-56f4-443b-9f8c-71c6e0318c4d	en-GB	[Lat:54.1026000976563][Long:-2.48440003395081][Town:Bentham,England][PostCode:00000][IsGps:true]manchester evening news man united	1		en-GB	premium		en	GB	en-GB		0F5F0738ECF06B0D380815BBED106A0B	FFB6EB801CA24955A17477C305CB7D5A	manchester evening news man united	54.1026000976563	-2.48440003395081	Bentham	England	United Kingdom	AMAZWB	Kindle Fire&apos;s Web Search Vertical	0	8/26/2024 1:11:00 AM	-1	1281	1280	5	1	1	[{"predictions": {"en": 0.99816, "nl": 0.00085, "da": 0.000806, "de": 0.000135, "sv": 1.4e-05, "id": 7e-06, "nb": 6e-06, "fr": 5e-06, "vi": 4e-06, "fil": 4e-06}, "text": "manchester evening news man united"}]	"en": 0.99816, "nl": 0.00085, "da": 0.000806, "de": 0.000135, "sv": 1.4e-05, "id": 7e-06, "nb": 6e-06, "fr": 5e-06, "vi": 4e-06, "fil": 4e-06	0	en-GB	northeurope	en: 0.99816, nl: 0.00085, da: 0.000806, de: 0.000135, sv: 1.4E-05, id: 7E-06, nb: 6E-06, fr: 5E-06, vi: 4E-06, fil: 4E-06	1	1	0	0	5			1	1	5	4	1	1	en	en	This query is likely interested in recent web pages. Please think about if the document is recent enough to be a good match for the user’s needs.	The user likely wants documents that are recent. Please pay attention to dates in the Result page. Assume the query was typed in just now.	f823bc67-7172-40dd-8143-d13e0f9eea04	2024-08-26T12:01:03.0000000+00:00	en-GB	0
5ccdaac7-65e8-4340-8a5b-2866c587bf56	en-WW	[Lat:45.32529830932617][Long:14.440899848937988][Town:Rijeka,Primorje-Gorski Kotar County][PostCode:00000][IsGps:true]comedian who confronted beatlemania lost dies	1		hr-HR	costoptimized		en	HR	en-GB		004F2B1FA4D66B8B2EEA3FF8A5A46AC0	FFB34BE9400A4F008A154C5AD15BCFBE	comedian who confronted beatlemania lost dies	45.32529830932617	14.440899848937988	Rijeka	Primorje-Gorski Kotar County	Croatia	s:web:null	Missing form code where vertical is web and referrer is null	0	8/26/2024 1:21:55 AM	-1	0	-1	1	1	1	[{"predictions": {"en": 0.999106, "de": 0.000862, "es": 1.4e-05, "nl": 9e-06, "it": 3e-06, "id": 1e-06, "pt-PT": 1e-06, "lb": 1e-06, "ca": 1e-06}, "text": "comedian who confronted beatlemania lost dies"}]	"en": 0.999106, "de": 0.000862, "es": 1.4e-05, "nl": 9e-06, "it": 3e-06, "id": 1e-06, "pt-PT": 1e-06, "lb": 1e-06, "ca": 1e-06	1	en-GB	northeurope	en: 0.999106, de: 0.000862, es: 1.4E-05, nl: 9E-06, it: 3E-06, id: 1E-06, pt-PT: 1E-06, lb: 1E-06, ca: 1E-06	1	1	1	0	5			1	1	5	5	0	1	en	en	This query is likely interested in recent web pages. Please think about if the document is recent enough to be a good match for the user’s needs.	The user likely wants documents that are recent. Please pay attention to dates in the Result page. Assume the query was typed in just now.	f823bc67-7172-40dd-8143-d13e0f9eea04	2024-08-26T12:01:03.0000000+00:00	hr-HR	0
5d5df580-1887-4e2c-8444-feea5367ef29	zh-CN	[Lat:28.222400665283203][Long:112.9489974975586][Town:Yuelu District,Hunan][PostCode:00000][IsGps:true]医保最新缴费标准	1		zh-CN	premium		zh	CN	zh-CN		3120BE2E3FB56D921B98AACC3EB66C9F	001A7F14921C477B9902170CFB6DE4E9	医保最新缴费标准	28.222400665283203	112.9489974975586	Yuelu District	Hunan	China	ANSPH1		-1	8/26/2024 1:25:01 AM	-1	0	-1	0	0	1	[{"predictions": {"zh-Hans": 0.999989, "zh-Hant": 1e-05, "ko": 1e-06}, "text": "医保最新缴费标准"}]	"zh-Hans": 0.999989, "zh-Hant": 1e-05, "ko": 1e-06	1	zh-CN	koreasouth	zh-Hans: 0.999989, zh-Hant: 1E-05, ko: 1E-06	1	1	1	0	10			1	1	10	10	1	1	zh	zh-Hans	此查询可能对最近的网页感兴趣。 请考虑该文档是否足够新，可以满足用户的需求。	用户可能想要最近的文档。 请注意结果页面中的日期。 假设查询是刚才被输入的。	f823bc67-7172-40dd-8143-d13e0f9eea04	2024-08-26T12:01:03.0000000+00:00	zh-CN	1
60023c94-df00-4a17-aedb-6517e94cce68	en-WW	[Lat:24.92460060119629][Long:67.08699798583984][Town:Karachi,Sindh][PostCode:00000][IsGps:true]militant killings in balochistan tomorrow	1		en-PK	costoptimized		en	PK	en-IN			FFB99FC751614B0290B27E1F2231E95C	militant killings in balochistan tomorrow	24.92460060119629	67.08699798583984	Karachi	Sindh	Pakistan	CHROMN	FC for Chrome Omnibox	0	8/26/2024 2:00:02 AM	-1	0	-1	1	1	1	[{"predictions": {"en": 0.93367, "de": 0.034709, "sw": 0.020521, "nl": 0.006734, "ro": 0.002034, "sv": 0.000905, "pl": 0.000566, "fr": 0.000246, "af": 0.000236, "lb": 0.000176}, "text": "militant killings in balochistan tomorrow"}]	"en": 0.93367, "de": 0.034709, "sw": 0.020521, "nl": 0.006734, "ro": 0.002034, "sv": 0.000905, "pl": 0.000566, "fr": 0.000246, "af": 0.000236, "lb": 0.000176	1	en-IN	koreasouth	en: 0.93367, de: 0.034709, sw: 0.020521, nl: 0.006734, ro: 0.002034, sv: 0.000905, pl: 0.000566, fr: 0.000246, af: 0.000236, lb: 0.000176	1	1	1	0	9			1	1	9	9	0	1	en	en	This query is likely interested in recent web pages. Please think about if the document is recent enough to be a good match for the user’s needs.	The user likely wants documents that are recent. Please pay attention to dates in the Result page. Assume the query was typed in just now.	f823bc67-7172-40dd-8143-d13e0f9eea04	2024-08-26T12:01:03.0000000+00:00	en-PK	0
6571b36b-9fe2-488f-b402-c9bbe54e9dea	es-ES	[Lat:43.54209899902344][Long:-5.663400173187256][Town:Gijon,Principality Of Asturias][PostCode:00000][IsGps:true]gerente auvasa 2024	1		es-ES	premium		es	ES	es-ES		25FACC6156AC6FF71E26D88657AC6E3F	001E0EFCB8634E649437CDFFF4236E55	gerente auvasa 2024	43.54209899902344	-5.663400173187256	Gijon	Principality Of Asturias	Spain	QBRE	top query box onresults page	0	8/26/2024 12:31:01 AM	-1	0	-1	1	0	1	[{"predictions": {"pt-PT": 0.854453, "fi": 0.026177, "hu": 0.024809, "nl": 0.021869, "ro": 0.020305, "et": 0.011367, "es": 0.010983, "de": 0.008243, "lt": 0.007019, "tr": 0.004187}, "text": "gerente auvasa 2024"}]	"pt-PT": 0.854453, "fi": 0.026177, "hu": 0.024809, "nl": 0.021869, "ro": 0.020305, "et": 0.011367, "es": 0.010983, "de": 0.008243, "lt": 0.007019, "tr": 0.004187	1	es-ES	northeurope	pt-PT: 0.854453, fi: 0.026177, hu: 0.024809, nl: 0.021869, ro: 0.020305, et: 0.011367, es: 0.010983, de: 0.008243, lt: 0.007019, tr: 0.004187	0	0	0	0	6			1	0	6	0	1	1	es	pt-PT	Esta consulta probablemente esté enfocada en páginas web recientes. Piense si el documento es lo suficientemente reciente como para que coincida con las necesidades del usuario	Es probable que el usuario quiera documentos que sean recientes. Preste atención a las fechas en la página de resultados. Supongamos que la consulta se escribió hace un momento.	f823bc67-7172-40dd-8143-d13e0f9eea04	2024-08-26T12:01:03.0000000+00:00	es-ES	0
6796b83f-f83a-4457-ac17-ba1f4781f4e6	pt-BR	[Lat:-22.863899230957][Long:-43.1632995605469][Town:,][PostCode:00000][IsGps:true]donald turning green with	1		pt-BR	premium		pt	BR	pt-BR		3CF4AC346AEA6ABB1CD2B8D26B796BE5	1187BCDE9B0F4DFB89746F11603563AF	donald turning green with	-22.863899230957	-43.1632995605469				IE8SRC	IE8 Search	0	8/26/2024 12:56:46 AM	-1	0	-1	1	0	1	[{"predictions": {"en": 0.997835, "da": 0.000971, "id": 0.000391, "nl": 0.000299, "nb": 0.000188, "sv": 0.000108, "pl": 5.6e-05, "fil": 3.9e-05, "de": 2.8e-05, "mt": 1.5e-05}, "text": "donald turning green with"}]	"en": 0.997835, "da": 0.000971, "id": 0.000391, "nl": 0.000299, "nb": 0.000188, "sv": 0.000108, "pl": 5.6e-05, "fil": 3.9e-05, "de": 2.8e-05, "mt": 1.5e-05	0	pt-BR	eastus	en: 0.997835, da: 0.000971, id: 0.000391, nl: 0.000299, nb: 0.000188, sv: 0.000108, pl: 5.6E-05, fil: 3.9E-05, de: 2.8E-05, mt: 1.5E-05	1	1	1	0	8			1	1	7	6	0	1	pt	en	Essa busca está provavelmente interessada em páginas de internet recentes. Por favor, analise se o documento é recente, o suficiente para que seja considerado satisfatório ás necessidades do usuário.	Provavelmente o usuário deseja encontrar documentos recentes. Por favor, preste atenção às datas apresentadas na "Página de Resultados" e assuma que a palavra de busca tenha sido digitada no presente (hoje).	f823bc67-7172-40dd-8143-d13e0f9eea04	2024-08-26T12:01:03.0000000+00:00	pt-BR	0
681a4671-a633-48e5-9c17-f5dea2b3719b	fr-FR	[Lat:47.0074005126953][Long:1.52890002727509][Town:Moulins-sur-Céphons,Centre-Val de Loire][PostCode:00000][IsGps:true]ford cancels suv delays	1		fr-FR	premium		fr	FR	fr-FR			014F882A4E7C4FBCA772D9507F2BD723	ford cancels suv delays	47.0074005126953	1.52890002727509	Moulins-sur-Céphons	Centre-Val de Loire	France	QBLH	Homepage Query Box - Flight 0 - Web	0	8/26/2024 2:10:17 AM	-1	0	-1	0	0	1	[{"predictions": {"en": 0.983793, "ca": 0.007876, "fr": 0.003249, "sv": 0.002482, "pt-PT": 0.001051, "ro": 0.000421, "da": 0.000398, "tr": 0.000255, "es": 0.000148, "az-Latn": 0.000129}, "text": "ford cancels suv delays"}]	"en": 0.983793, "ca": 0.007876, "fr": 0.003249, "sv": 0.002482, "pt-PT": 0.001051, "ro": 0.000421, "da": 0.000398, "tr": 0.000255, "es": 0.000148, "az-Latn": 0.000129	0	fr-FR	northeurope	en: 0.983793, ca: 0.007876, fr: 0.003249, sv: 0.002482, pt-PT: 0.001051, ro: 0.000421, da: 0.000398, tr: 0.000255, es: 0.000148, az-Latn: 0.000129	1	1	1	0	9			1	1	9	9	0	1	fr	en	L'utilisateur va probablement privilégier des résultats publiés récemment.  Pour évaluer la pertinence d'un résultat, prenez en compte sa date de publication.	L'utilisateur recherche probablement des résultats récents. Soyez attentif aux dates de publication et de mise à jour de la page de résultat.  Évaluez les résultats comme si la requête venait d'être effectuée.	f823bc67-7172-40dd-8143-d13e0f9eea04	2024-08-26T12:01:03.0000000+00:00	fr-FR	0
697281e2-8dee-4242-8ee1-1a92984afe1a	en-US	[Lat:30.26729965209961][Long:-89.77749633789062][Town:Slidell,Louisiana][PostCode:00000][IsGps:true]ford cancels electric delays ev	1		en-US	premium		en	US	en-US			00F0940A1DC84F90AF20A2C7CAFA5188	ford cancels electric delays ev	30.26729965209961	-89.77749633789062	Slidell	Louisiana	United States	s:web:null	Missing form code where vertical is web and referrer is null	0	8/26/2024 2:35:55 AM	-1	0	-1	1	0	1	[{"predictions": {"en": 0.987821, "ca": 0.006895, "fr": 0.002954, "ro": 0.002165, "da": 4.2e-05, "es": 2.7e-05, "lb": 2.3e-05, "sv": 2.1e-05, "de": 1.4e-05, "nl": 1.4e-05}, "text": "ford cancels electric delays ev"}]	"en": 0.987821, "ca": 0.006895, "fr": 0.002954, "ro": 0.002165, "da": 4.2e-05, "es": 2.7e-05, "lb": 2.3e-05, "sv": 2.1e-05, "de": 1.4e-05, "nl": 1.4e-05	1	en-US	northcentralus	en: 0.987821, ca: 0.006895, fr: 0.002954, ro: 0.002165, da: 4.2E-05, es: 2.7E-05, lb: 2.3E-05, sv: 2.1E-05, de: 1.4E-05, nl: 1.4E-05	1	1	1	0	7			1	1	7	7	1	1	en	en	This query is likely interested in recent web pages. Please think about if the document is recent enough to be a good match for the user’s needs.	The user likely wants documents that are recent. Please pay attention to dates in the Result page. Assume the query was typed in just now.	f823bc67-7172-40dd-8143-d13e0f9eea04	2024-08-26T12:01:03.0000000+00:00	en-US	0
6abe836e-3e13-409b-bbf0-5316773a1a98	es-ES	[Lat:41.387901306152344][Long:2.1698999404907227][Town:Barcelona,Catalonia][PostCode:00000][IsGps:true]mejores linias de fibra	1		es-ES	premium		es	ES	es-ES		3D51F66F1C4A6E510AB9E2E81D036F4C	001B24F435E045639E3AC48FC3F999CD	mejores linias de fibra	41.387901306152344	2.1698999404907227	Barcelona	Catalonia	Spain	PERE	Bottom Page Discrete Numbering - Search Results	0	8/26/2024 12:27:40 AM	-1	0	-1	1	0	1	[{"predictions": {"es": 0.997529, "gl": 0.002198, "ca": 0.000168, "pt-PT": 0.000104}, "text": "mejores linias de fibra"}]	"es": 0.997529, "gl": 0.002198, "ca": 0.000168, "pt-PT": 0.000104	1	es-ES	northeurope	es: 0.997529, gl: 0.002198, ca: 0.000168, pt-PT: 0.000104	1	1	0	0	7			1	1	7	3	1	1	es	es	Esta consulta probablemente esté enfocada en páginas web recientes. Piense si el documento es lo suficientemente reciente como para que coincida con las necesidades del usuario	Es probable que el usuario quiera documentos que sean recientes. Preste atención a las fechas en la página de resultados. Supongamos que la consulta se escribió hace un momento.	f823bc67-7172-40dd-8143-d13e0f9eea04	2024-08-26T12:01:03.0000000+00:00	es-ES	0
6d5ae183-b871-45ee-be45-c7dd69a3fc96	it-IT	[Lat:43.4734001159668][Long:11.146699905395508][Town:Poggibonsi,Tuscany][PostCode:00000][IsGps:true]facebook and twitter cover photo dimensions	1		it-IT	premium		ar	IT	ar-EG			0066D341957B45D6A5F0FA72FE9D9ABB	facebook and twitter cover photo dimensions	43.4734001159668	11.146699905395508	Poggibonsi	Tuscany	Italy	s:web:null:chrome	FC for Chrome Default Searches	0	8/26/2024 2:55:44 AM	-1	0	-1	0	0	1	[{"predictions": {"en": 0.999662, "id": 0.000172, "fil": 0.000144, "fr": 1e-05, "pt-PT": 6e-06, "sw": 2e-06, "de": 1e-06}, "text": "facebook and twitter cover photo dimensions"}]	"en": 0.999662, "id": 0.000172, "fil": 0.000144, "fr": 1e-05, "pt-PT": 6e-06, "sw": 2e-06, "de": 1e-06	1	ar-EG	northeurope	en: 0.999662, id: 0.000172, fil: 0.000144, fr: 1E-05, pt-PT: 6E-06, sw: 2E-06, de: 1E-06	0	0	0	0	7			1	0	7	0	1	1	ar	en	من المحتمل أن يكون هذا الاستعلام مهتمًا بصفحات الويب الحديثة. الرجاء التفكير فيما إذا كان المستند حديثًا بما يكفي ليطابق احتياجات المستخدم 	من المحتمل أن يرغب المستخدم في مستندات حديثة. يرجى الانتباه إلى التواريخ في صفحة النتائج. مع افتراض ان البحث قد كتب للتو	f823bc67-7172-40dd-8143-d13e0f9eea04	2024-08-26T12:01:03.0000000+00:00	it-IT	0
6fb79d14-8ee4-468b-a145-8dd4b0cf572a	de-CH	[Lat:37.382598876953125][Long:-5.996300220489502][Town:Seville,Andalusia][PostCode:00000][IsGps:true]ps plus february reddit	1		de-CH	full		es	CH	es-ES		005D417F4BBF6C633C2355CE4AF56DA2	06092F10626441C4BD439A1FF810D9B3	ps plus february reddit	37.382598876953125	-5.996300220489502	Seville	Andalusia	Spain	s:web:null:chrome	FC for Chrome Default Searches	0	8/26/2024 1:26:39 AM	-1	0	-1	0	0	1	[{"predictions": {"en": 0.965075, "fr": 0.018149, "de": 0.01338, "sv": 0.00133, "lb": 0.001083, "tr": 0.000235, "id": 0.000221, "nl": 0.000144, "cs": 7.8e-05, "da": 6.3e-05}, "text": "ps plus february reddit"}]	"en": 0.965075, "fr": 0.018149, "de": 0.01338, "sv": 0.00133, "lb": 0.001083, "tr": 0.000235, "id": 0.000221, "nl": 0.000144, "cs": 7.8e-05, "da": 6.3e-05	1	es-ES	northeurope	en: 0.965075, fr: 0.018149, de: 0.01338, sv: 0.00133, lb: 0.001083, tr: 0.000235, id: 0.000221, nl: 0.000144, cs: 7.8E-05, da: 6.3E-05	0	0	0	0	9			1	0	9	0	1	1	es	en	Esta consulta probablemente esté enfocada en páginas web recientes. Piense si el documento es lo suficientemente reciente como para que coincida con las necesidades del usuario	Es probable que el usuario quiera documentos que sean recientes. Preste atención a las fechas en la página de resultados. Supongamos que la consulta se escribió hace un momento.	f823bc67-7172-40dd-8143-d13e0f9eea04	2024-08-26T12:01:03.0000000+00:00	de-CH	1
