id	market	text	weight	userAgent	trueMarket	trafficPriority	urlAugmentation	uiLanguage	uiRegion	judgeMarket	anid	muid	impressionguid	querytext	lat	lng	city	state	country	formcode	formcodename	formcodeisorganic	requesttime	nrtpopulationfreq	historicalpopulationfreq	populationfreq	decile	isoverall	source	logquerylanguage	querylanguagepredictionhumpbackv1	isloglocation	judgemarket	datacenter	querylanguageprediction	superfresh	googletimestampsuperfresh	bingpostwebsuperfresh	constanthead	googletimestampcount	bingnewsanswercount	googlenewsanswercount	freshgoogle365	superfreshgoogle365	googletimestamplessthan365dayscount	googletimestamplessthan7dayscount	implicittemporal	forbvbusage	judgelanguage	querylanguage	intent	results	nrt_query_set_id	nrt_sampling_start_time	truemarket	isseasonalfresh
6fd8cab0-f388-4712-8d62-a6633ba736b9	en-US	[Lat:37.77730178833008][Long:-98.00440216064453][Town:Ninnescah,Kansas][PostCode:00000][IsGps:true]college week 1 predictions	1		en-US	premium		en	US	en-US			004322F6821745BD9EFDFC70CB743E83	college week 1 predictions	37.77730178833008	-98.00440216064453	Ninnescah	Kansas	United States	ANSAB1		-1	8/26/2024 12:14:42 AM	-1	15	14	2	0	1	[{"predictions": {"en": 0.988879, "nl": 0.008825, "fr": 0.001249, "it": 0.00034, "af": 0.00027, "de": 0.000251, "ro": 7.3e-05, "lb": 4.9e-05, "id": 2.1e-05, "es": 7e-06}, "text": "college week 1 predictions"}]	"en": 0.988879, "nl": 0.008825, "fr": 0.001249, "it": 0.00034, "af": 0.00027, "de": 0.000251, "ro": 7.3e-05, "lb": 4.9e-05, "id": 2.1e-05, "es": 7e-06	1	en-US	eastus	en: 0.988879, nl: 0.008825, fr: 0.001249, it: 0.00034, af: 0.00027, de: 0.000251, ro: 7.3E-05, lb: 4.9E-05, id: 2.1E-05, es: 7E-06	1	1	1	0	6			1	1	6	6	1	1	en	en	This query is likely interested in recent web pages. Please think about if the document is recent enough to be a good match for the user’s needs.	The user likely wants documents that are recent. Please pay attention to dates in the Result page. Assume the query was typed in just now.	f823bc67-7172-40dd-8143-d13e0f9eea04	2024-08-26T12:01:03.0000000+00:00	en-US	1
714c0b5f-bfe5-4049-8cd3-a6f96d3a1524	en-US	[Lat:41.885799407958984][Long:-87.62529754638672][Town:Chicago,Illinois][PostCode:00000][IsGps:true]smashed asteroid debris could end reaching	1		en-US	premium		en	US	en-US		2B3D65888306677717D4716E8269663B	00707FF86D0E4E7CABAF76C60E20E6FE	smashed asteroid debris could end reaching	41.885799407958984	-87.62529754638672	Chicago	Illinois	United States	s:web:null	Missing form code where vertical is web and referrer is null	0	8/26/2024 12:55:08 AM	-1	0	-1	0	0	1	[{"predictions": {"en": 0.965191, "id": 0.029704, "fr": 0.0026, "da": 0.001561, "ms": 0.000193, "sw": 0.000188, "it": 0.000174, "fil": 0.000143, "et": 0.000142, "mt": 2.3e-05}, "text": "smashed asteroid debris could end reaching"}]	"en": 0.965191, "id": 0.029704, "fr": 0.0026, "da": 0.001561, "ms": 0.000193, "sw": 0.000188, "it": 0.000174, "fil": 0.000143, "et": 0.000142, "mt": 2.3e-05	1	en-US	westus	en: 0.965191, id: 0.029704, fr: 0.0026, da: 0.001561, ms: 0.000193, sw: 0.000188, it: 0.000174, fil: 0.000143, et: 0.000142, mt: 2.3E-05	1	1	0	0	6			1	1	6	4	0	1	en	en	This query is likely interested in recent web pages. Please think about if the document is recent enough to be a good match for the user’s needs.	The user likely wants documents that are recent. Please pay attention to dates in the Result page. Assume the query was typed in just now.	f823bc67-7172-40dd-8143-d13e0f9eea04	2024-08-26T12:01:03.0000000+00:00	en-US	0
72888258-799e-46ca-a31c-e6c29bba1d34	en-AU	[Lat:-37.6705017089844][Long:145.056198120117][Town:Mill Park,VIC][PostCode:00000][IsGps:true]galaxy s24 ultra review	1		en-AU	premium		en	AU	en-AU			FF76B7B54B1F4564920F35F046A11ADA	galaxy s24 ultra review	-37.6705017089844	145.056198120117	Mill Park	VIC	Australia	QBRE	top query box onresults page	0	8/26/2024 2:50:49 AM	-1	2002	2001	5	1	1	[{"predictions": {"en": 0.994853, "de": 0.001815, "fr": 0.001715, "vi": 0.000359, "id": 0.000301, "sk": 0.000254, "pt-PT": 0.000145, "lb": 0.000103, "ro": 8.3e-05, "it": 7.4e-05}, "text": "galaxy s24 ultra review"}]	"en": 0.994853, "de": 0.001815, "fr": 0.001715, "vi": 0.000359, "id": 0.000301, "sk": 0.000254, "pt-PT": 0.000145, "lb": 0.000103, "ro": 8.3e-05, "it": 7.4e-05	0	en-AU	koreasouth	en: 0.994853, de: 0.001815, fr: 0.001715, vi: 0.000359, id: 0.000301, sk: 0.000254, pt-PT: 0.000145, lb: 0.000103, ro: 8.3E-05, it: 7.4E-05	0	0	0	0	7			1	0	7	0	1	1	en	en	This query is likely interested in recent web pages. Please think about if the document is recent enough to be a good match for the user’s needs.	The user likely wants documents that are recent. Please pay attention to dates in the Result page. Assume the query was typed in just now.	f823bc67-7172-40dd-8143-d13e0f9eea04	2024-08-26T12:01:03.0000000+00:00	en-AU	0
77dd7d2b-b3c9-4c96-a8ef-88427b65dfb5	en-WW	[Lat:61.7375984191895][Long:24.288200378418][Town:Orivesi,Pirkanmaa][PostCode:00000][IsGps:true]ceo pavel durov eu digital services	1		en-FI	costoptimized		en	FI	en-GB		2AD5853FAEF36BB00F8191D8AF8C6AC4	007A06D81F5F443B93CED41FFBA2683D	ceo pavel durov eu digital services	61.7375984191895	24.288200378418	Orivesi	Pirkanmaa	Finland	s:web:null	Missing form code where vertical is web and referrer is null	0	8/26/2024 1:21:09 AM	-1	0	-1	1	0	1	[{"predictions": {"pt-PT": 0.910757, "gl": 0.045084, "en": 0.026094, "ro": 0.009832, "ca": 0.003075, "es": 0.002677, "sk": 0.000863, "cs": 0.000705, "fr": 0.000258, "sl": 0.000212}, "text": "ceo pavel durov eu digital services"}]	"pt-PT": 0.910757, "gl": 0.045084, "en": 0.026094, "ro": 0.009832, "ca": 0.003075, "es": 0.002677, "sk": 0.000863, "cs": 0.000705, "fr": 0.000258, "sl": 0.000212	0	en-GB	northeurope	pt-PT: 0.910757, gl: 0.045084, en: 0.026094, ro: 0.009832, ca: 0.003075, es: 0.002677, sk: 0.000863, cs: 0.000705, fr: 0.000258, sl: 0.000212	1	1	1	0	7			1	1	7	7	0	1	en	pt-PT	This query is likely interested in recent web pages. Please think about if the document is recent enough to be a good match for the user’s needs.	The user likely wants documents that are recent. Please pay attention to dates in the Result page. Assume the query was typed in just now.	f823bc67-7172-40dd-8143-d13e0f9eea04	2024-08-26T12:01:03.0000000+00:00	en-FI	0
79274c2c-3ae8-4925-bbe5-c7e0ccb294cc	pt-BR	[Lat:-4.56260013580322][Long:-44.2182998657227][Town:Capinzal do Norte,Maranhão][PostCode:00000][IsGps:true]marijuana news poll	1		pt-BR	premium		pt	BR	pt-BR		17352485674E6ABD0889302866676B25	0FBC1DA30EB44071ABB4BABDC5EE0CBA	marijuana news poll	-4.56260013580322	-44.2182998657227	Capinzal do Norte	Maranhão	Brazil	s:web:null:chrome	FC for Chrome Default Searches	0	8/26/2024 12:06:11 AM	-1	0	-1	0	0	1	[{"predictions": {"en": 0.986873, "ca": 0.005685, "es": 0.002845, "et": 0.001336, "sv": 0.00075, "de": 0.000675, "lb": 0.000417, "ro": 0.000275, "pt-BR": 0.000196, "mt": 0.000188}, "text": "marijuana news poll"}]	"en": 0.986873, "ca": 0.005685, "es": 0.002845, "et": 0.001336, "sv": 0.00075, "de": 0.000675, "lb": 0.000417, "ro": 0.000275, "pt-PT": 0.000196, "mt": 0.000188	0	pt-BR	eastus	en: 0.986873, ca: 0.005685, es: 0.002845, et: 0.001336, sv: 0.00075, de: 0.000675, lb: 0.000417, ro: 0.000275, pt-PT: 0.000196, mt: 0.000188	1	1	0	0	6			1	1	6	3	1	1	pt	en	Essa busca está provavelmente interessada em páginas de internet recentes. Por favor, analise se o documento é recente, o suficiente para que seja considerado satisfatório ás necessidades do usuário.	Provavelmente o usuário deseja encontrar documentos recentes. Por favor, preste atenção às datas apresentadas na "Página de Resultados" e assuma que a palavra de busca tenha sido digitada no presente (hoje).	f823bc67-7172-40dd-8143-d13e0f9eea04	2024-08-26T12:01:03.0000000+00:00	pt-BR	0
7b5db1d1-13f0-45ff-9163-b117d044809d	es-ES	[Lat:42.817298889160156][Long:-1.6447999477386475][Town:Pamplona,Chartered Community Of Navarre][PostCode:00000][IsGps:true]pembrolizumab approval adjuvant treatment	1		es-ES	premium		es	ES	es-ES		260448A8513164153A5E5C2550376521	017A344468064534BC5D47254C8833A8	pembrolizumab approval adjuvant treatment	42.817298889160156	-1.6447999477386475	Pamplona	Chartered Community Of Navarre	Spain	ANNTA1		-1	8/26/2024 1:00:53 AM	-1	0	-1	0	0	1	[{"predictions": {"en": 0.784284, "pt-PT": 0.099137, "ca": 0.047909, "mt": 0.02655, "fr": 0.010375, "hu": 0.0087, "sv": 0.005648, "de": 0.003359, "ms": 0.002473, "et": 0.002135}, "text": "pembrolizumab approval adjuvant treatment"}]	"en": 0.784284, "pt-PT": 0.099137, "ca": 0.047909, "mt": 0.02655, "fr": 0.010375, "hu": 0.0087, "sv": 0.005648, "de": 0.003359, "ms": 0.002473, "et": 0.002135	1	es-ES	northeurope	en: 0.784284, pt-PT: 0.099137, ca: 0.047909, mt: 0.02655, fr: 0.010375, hu: 0.0087, sv: 0.005648, de: 0.003359, ms: 0.002473, et: 0.002135	0	0	0	0	7			1	0	6	0	1	1	es	en	Esta consulta probablemente esté enfocada en páginas web recientes. Piense si el documento es lo suficientemente reciente como para que coincida con las necesidades del usuario	Es probable que el usuario quiera documentos que sean recientes. Preste atención a las fechas en la página de resultados. Supongamos que la consulta se escribió hace un momento.	f823bc67-7172-40dd-8143-d13e0f9eea04	2024-08-26T12:01:03.0000000+00:00	es-ES	0
84106584-3cce-434a-b5a8-02b93651369b	es-ES	[Lat:39.57440185546875][Long:3.2014000415802][Town:Manacor,Balearic Islands][PostCode:00000][IsGps:true]best way to make money india	1		es-ES	premium		es	ES	es-ES			0317B7A0265248769C0F4C9F8AE4A7D5	best way to make money india	39.57440185546875	3.2014000415802	Manacor	Balearic Islands	Spain	SYS1FC		-1	8/26/2024 2:36:59 AM	-1	0	-1	1	0	1	[{"predictions": {"en": 0.999962, "fil": 3.1e-05, "id": 7e-06}, "text": "best way to make money india"}]	"en": 0.999962, "fil": 3.1e-05, "id": 7e-06	1	es-ES	northeurope	en: 0.999962, fil: 3.1E-05, id: 7E-06	0	0	0	0	6			1	0	6	0	1	1	es	en	Esta consulta probablemente esté enfocada en páginas web recientes. Piense si el documento es lo suficientemente reciente como para que coincida con las necesidades del usuario	Es probable que el usuario quiera documentos que sean recientes. Preste atención a las fechas en la página de resultados. Supongamos que la consulta se escribió hace un momento.	f823bc67-7172-40dd-8143-d13e0f9eea04	2024-08-26T12:01:03.0000000+00:00	es-ES	1
8998b3d3-c4c8-4b14-8fe9-4a73e89f4797	pt-BR	[Lat:-11.079299926757812][Long:-37.14080047607422][Town:Aracaju,Sergipe][PostCode:00000][IsGps:true]super tax news	1		pt-BR	premium		pt	BR	pt-BR		05A6BE0838196C6B0FB3AAA5396C6D9B	028956D5EA2D4E3B968C872A0EC22850	super tax news	-11.079299926757812	-37.14080047607422	Aracaju	Sergipe	Brazil	s:web:null:chrome	FC for Chrome Default Searches	0	8/26/2024 1:15:40 AM	-1	0	-1	0	0	1	[{"predictions": {"en": 0.988156, "pt-BR": 0.002654, "vi": 0.0022, "de": 0.001951, "fr": 0.001174, "nl": 0.001007, "ro": 0.000789, "lb": 0.000525, "pl": 0.000259, "sv": 0.000217}, "text": "super tax news"}]	"en": 0.988156, "pt-PT": 0.002654, "vi": 0.0022, "de": 0.001951, "fr": 0.001174, "nl": 0.001007, "ro": 0.000789, "lb": 0.000525, "pl": 0.000259, "sv": 0.000217	1	pt-BR	eastus	en: 0.988156, pt-PT: 0.002654, vi: 0.0022, de: 0.001951, fr: 0.001174, nl: 0.001007, ro: 0.000789, lb: 0.000525, pl: 0.000259, sv: 0.000217	0	0	0	0	6			1	0	6	0	1	1	pt	en	Essa busca está provavelmente interessada em páginas de internet recentes. Por favor, analise se o documento é recente, o suficiente para que seja considerado satisfatório ás necessidades do usuário.	Provavelmente o usuário deseja encontrar documentos recentes. Por favor, preste atenção às datas apresentadas na "Página de Resultados" e assuma que a palavra de busca tenha sido digitada no presente (hoje).	f823bc67-7172-40dd-8143-d13e0f9eea04	2024-08-26T12:01:03.0000000+00:00	pt-BR	0
90b5f6c5-77dc-4eb7-a940-ded808c23133	en-GB	[Lat:51.52790069580078][Long:0.02669999934732914][Town:Newham,Greater London][PostCode:00000][IsGps:true]paralympics will drop ban olympic rings	1		en-GB	premium		en	GB	en-GB			FFA14CD05D7941D0AAB447686C64CFA4	paralympics will drop ban olympic rings	51.52790069580078	0.02669999934732914	Newham	Greater London	United Kingdom	s:web:null	Missing form code where vertical is web and referrer is null	0	8/26/2024 1:57:29 AM	-1	0	-1	0	1	1	[{"predictions": {"en": 0.996309, "nl": 0.003167, "ca": 0.000212, "de": 7.7e-05, "fr": 4.2e-05, "hu": 3.7e-05, "fil": 3.5e-05, "ro": 3.4e-05, "da": 2e-05, "id": 1.3e-05}, "text": "paralympics will drop ban olympic rings"}]	"en": 0.996309, "nl": 0.003167, "ca": 0.000212, "de": 7.7e-05, "fr": 4.2e-05, "hu": 3.7e-05, "fil": 3.5e-05, "ro": 3.4e-05, "da": 2e-05, "id": 1.3e-05	1	en-GB	northeurope	en: 0.996309, nl: 0.003167, ca: 0.000212, de: 7.7E-05, fr: 4.2E-05, hu: 3.7E-05, fil: 3.5E-05, ro: 3.4E-05, da: 2E-05, id: 1.3E-05	1	1	1	0	7			1	1	7	7	0	1	en	en	This query is likely interested in recent web pages. Please think about if the document is recent enough to be a good match for the user’s needs.	The user likely wants documents that are recent. Please pay attention to dates in the Result page. Assume the query was typed in just now.	f823bc67-7172-40dd-8143-d13e0f9eea04	2024-08-26T12:01:03.0000000+00:00	en-GB	0
92a735c7-1c74-430c-86ca-2e797c41565e	en-IN	[Lat:23.5538005828857][Long:86.736198425293][Town:Raghunathpur,WB][PostCode:00000][IsGps:true]26th August 2024, News Halies In English For School Assembly: This article will provide you with the latest news headlines for school assembly. The news headlines will cover all the major topics ranging from national, international, political and sports	1		en-IN	premium		en	IN	en-IN	947C5960AA0F647BADEA3845FFFFFFFF	1EB70C736ACC6F660DDA18BA6B546E30	00094A27E4254D36AF379F0C010EB261	26th August 2024, News Halies In English For School Assembly: This article will provide you with the latest news headlines for school assembly. The news headlines will cover all the major topics ranging from national, international, political and sports	23.5538005828857	86.736198425293	Raghunathpur	WB	India	QBRE	top query box onresults page	0	8/26/2024 12:15:47 AM	-1	0	-1	0	0	1	[{"predictions": {"en": 1.0}, "text": "26th august 2024, news halies in english for school assembly: this article will provide you with the latest news headlines for school assembly. the news headlines will cover all the major topics ranging from national, international, political and sports"}]	"en": 1.0	0	en-IN	koreasouth	en: 1	1	1	0	0	8			1	1	7	7	0	1	en	en	This query is likely interested in recent web pages. Please think about if the document is recent enough to be a good match for the user’s needs.	The user likely wants documents that are recent. Please pay attention to dates in the Result page. Assume the query was typed in just now.	f823bc67-7172-40dd-8143-d13e0f9eea04	2024-08-26T12:01:03.0000000+00:00	en-IN	0
9583ed40-d8af-4299-b5e0-f9d1c426d137	es-ES	[Lat:40.43550109863281][Long:-3.716099977493286][Town:Madrid,Community Of Madrid][PostCode:00000][IsGps:true]recorrido de la etapa dia 27	1		es-ES	premium		es	ES	es-ES			043A33BF0ACA43128E64EB4006ECD591	recorrido de la etapa dia 27	40.43550109863281	-3.716099977493286	Madrid	Community Of Madrid	Spain	SWTRCM		-1	8/26/2024 2:36:05 AM	-1	0	-1	0	0	1	[{"predictions": {"es": 0.998412, "ca": 0.000669, "pt-PT": 0.000627, "gl": 0.000289, "ro": 2e-06}, "text": "recorrido de la etapa dia 27"}]	"es": 0.998412, "ca": 0.000669, "pt-PT": 0.000627, "gl": 0.000289, "ro": 2e-06	1	es-ES	eastus	es: 0.998412, ca: 0.000669, pt-PT: 0.000627, gl: 0.000289, ro: 2E-06	1	1	1	0	8			1	1	8	7	1	1	es	es	Esta consulta probablemente esté enfocada en páginas web recientes. Piense si el documento es lo suficientemente reciente como para que coincida con las necesidades del usuario	Es probable que el usuario quiera documentos que sean recientes. Preste atención a las fechas en la página de resultados. Supongamos que la consulta se escribió hace un momento.	f823bc67-7172-40dd-8143-d13e0f9eea04	2024-08-26T12:01:03.0000000+00:00	es-ES	1
96d7cca8-b6af-47a4-bcfd-d6b0fcbe2cdf	pt-PT	[Lat:41.342201232910156][Long:-8.557600021362305][Town:Trofa,Porto][PostCode:00000][IsGps:true]low tide at twilight chap 98 data de lançamento manga online	1		pt-PT	costoptimized		pt	PT	pt-BR			0FBD125005544F29B83A340A873A0056	low tide at twilight chap 98 data de lançamento manga online	41.342201232910156	-8.557600021362305	Trofa	Porto	Portugal	s:web:null:chrome	FC for Chrome Default Searches	0	8/26/2024 1:47:37 AM	-1	0	-1	0	0	1	[{"predictions": {"pt-BR": 0.943883, "en": 0.055379, "sw": 0.00069, "gl": 3.8e-05, "fr": 4e-06, "ro": 4e-06, "es": 1e-06, "it": 1e-06}, "text": "low tide at twilight chap 98 data de lançamento manga online"}]	"pt-PT": 0.943883, "en": 0.055379, "sw": 0.00069, "gl": 3.8e-05, "fr": 4e-06, "ro": 4e-06, "es": 1e-06, "it": 1e-06	1	pt-BR	northeurope	pt-PT: 0.943883, en: 0.055379, sw: 0.00069, gl: 3.8E-05, fr: 4E-06, ro: 4E-06, es: 1E-06, it: 1E-06	1	1	1	0	5			1	1	5	4	0	1	pt	pt-PT	Esta busca é mais provável de estar interessada em páginas web recentes. Por favor pense se o documento/página é recente o suficiente para corresponder as necessidades do usuário.	O usuário é mais provável querer documentos que são mais recentes. Por favor preste atenção as datas na página do resultado. Suponha que a busca foi escrita agora mesmo.	f823bc67-7172-40dd-8143-d13e0f9eea04	2024-08-26T12:01:03.0000000+00:00	pt-PT	0
97a4ab2d-fba4-4a3b-b538-8b1d89dcb20b	ar-EG	[Lat:32.516300201416016][Long:45.81589889526367][Town:Kut,Muhafazat Wasit][PostCode:00000][IsGps:true]الريال ضد بلد الوليد،خالد، َالالله ح َ	1		ar-EG	costoptimized		ar	EG	ar-EG		34105DB353306B513800490B52246AC0	0D021C7D34B142A4B968BA3452BA6204	الريال ضد بلد الوليد،خالد، َالالله ح َ	32.516300201416016	45.81589889526367	Kut	Muhafazat Wasit	Iraq	SWTRCM		-1	8/26/2024 12:44:52 AM	-1	0	-1	0	0	1	[{"predictions": {"ar": 0.999583, "fa": 0.000417}, "text": "الريال ضد بلد الوليد،خالد، َالالله ح َ"}]	"ar": 0.999583, "fa": 0.000417	1	ar-EG	northeurope	ar: 0.999583, fa: 0.000417	1	1	1	0	5			1	1	5	5	1	1	ar	ar	من المحتمل أن يكون هذا الاستعلام مهتمًا بصفحات الويب الحديثة. الرجاء التفكير فيما إذا كان المستند حديثًا بما يكفي ليطابق احتياجات المستخدم 	من المحتمل أن يرغب المستخدم في مستندات حديثة. يرجى الانتباه إلى التواريخ في صفحة النتائج. مع افتراض ان البحث قد كتب للتو	f823bc67-7172-40dd-8143-d13e0f9eea04	2024-08-26T12:01:03.0000000+00:00	ar-EG	0
9a49c114-181c-4655-86e9-02b7f9214d5f	en-US	[Lat:40.662899017334][Long:-89.7433013916016][Town:Limestone,IL][PostCode:00000][IsGps:true]best high schools in tennessee	1		en-US	premium		en	US	en-US			FF9534CDFF914467BE4ECD519B217B8C	best high schools in tennessee	40.662899017334	-89.7433013916016	Limestone	IL	United States	QBRE	top query box onresults page	0	8/26/2024 2:05:55 AM	-1	6873	6872	6	1	1	[{"predictions": {"en": 0.985576, "nl": 0.009355, "de": 0.004981, "lb": 7e-05, "da": 5e-06, "af": 4e-06, "sv": 3e-06, "fil": 2e-06, "fi": 1e-06, "pt-PT": 1e-06}, "text": "best high schools in tennessee"}]	"en": 0.985576, "nl": 0.009355, "de": 0.004981, "lb": 7e-05, "da": 5e-06, "af": 4e-06, "sv": 3e-06, "fil": 2e-06, "fi": 1e-06, "pt-PT": 1e-06	0	en-US	eastus	en: 0.985576, nl: 0.009355, de: 0.004981, lb: 7E-05, da: 5E-06, af: 4E-06, sv: 3E-06, fil: 2E-06, fi: 1E-06, pt-PT: 1E-06	0	0	0	0	5			1	0	5	0	1	1	en	en	This query is likely interested in recent web pages. Please think about if the document is recent enough to be a good match for the user’s needs.	The user likely wants documents that are recent. Please pay attention to dates in the Result page. Assume the query was typed in just now.	f823bc67-7172-40dd-8143-d13e0f9eea04	2024-08-26T12:01:03.0000000+00:00	en-US	1
a31fc354-9cf3-4bda-a36d-e53165e563f9	en-US	[Lat:38.91400146484375][Long:121.61470031738281][Town:Dalian,Liaoning][PostCode:00000][IsGps:true]兔子先生在线观看全集	1		zh-CN	premium		en	US	en-IN		07E965F2886F69CE09667192892C6805	FFACC3FE3B5E434C85C231B871AFDD9F	兔子先生在线观看全集	38.91400146484375	121.61470031738281	Dalian	Liaoning	China	QSRE3	Query Suggestion on Search Results	0	8/26/2024 12:33:19 AM	-1	19	18	3	1	1	[{"predictions": {"zh-Hans": 0.999989, "zh-Hant": 1e-05}, "text": "兔子先生在线观看全集"}]	"zh-Hans": 0.999989, "zh-Hant": 1e-05	1	en-IN	eastus	zh-Hans: 0.999989, zh-Hant: 1E-05	1	1	0	0	5			1	1	5	5	0	1	en	zh-Hans	This query is likely interested in recent web pages. Please think about if the document is recent enough to be a good match for the user’s needs.	The user likely wants documents that are recent. Please pay attention to dates in the Result page. Assume the query was typed in just now.	f823bc67-7172-40dd-8143-d13e0f9eea04	2024-08-26T12:01:03.0000000+00:00	zh-CN	0
a3324b85-d49a-4338-a809-94e6a55b1dc0	en-AU	[Lat:-37.79119873046875][Long:145.28160095214844][Town:Melbourne,Victoria][PostCode:00000][IsGps:true]Lessons from Ukraine and Impact for Australian Industry	1		en-AU	premium		en	AU	en-AU	39016F4D080136E18F730817FFFFFFFF	32F14C511CC165AF1CDA58951DA164EB	FF77D0346B8347CDA6DE449A2B5458B4	Lessons from Ukraine and Impact for Australian Industry	-37.79119873046875	145.28160095214844	Melbourne	Victoria	Australia	SSQUIC		-1	8/26/2024 12:07:25 AM	-1	0	-1	0	1	1	[{"predictions": {"en": 0.999999, "da": 1e-06}, "text": "lessons from ukraine and impact for australian industry"}]	"en": 0.999999, "da": 1e-06	1	en-AU	koreasouth	en: 0.999999, da: 1E-06	0	0	0	0	8			1	0	5	0	1	1	en	en	This query is likely interested in recent web pages. Please think about if the document is recent enough to be a good match for the user’s needs.	The user likely wants documents that are recent. Please pay attention to dates in the Result page. Assume the query was typed in just now.	f823bc67-7172-40dd-8143-d13e0f9eea04	2024-08-26T12:01:03.0000000+00:00	en-AU	0
a58cf934-9cb4-4796-b233-ce766aa936b8	en-GB	[Lat:52.3384017944336][Long:-2.23729991912842][Town:,][PostCode:00000][IsGps:true]bmw golf prize money payout	1		en-GB	premium		en	GB	en-GB			FF7D8472C06742A19EB733072E5D6DF2	bmw golf prize money payout	52.3384017944336	-2.23729991912842				QBRE	top query box onresults page	0	8/26/2024 2:49:27 AM	-1	44	43	3	1	1	[{"predictions": {"en": 0.594428, "fr": 0.167891, "de": 0.157837, "ro": 0.029873, "nl": 0.01929, "pl": 0.019175, "sr-Latn": 0.003307, "cs": 0.00203, "pt-PT": 0.001809, "af": 0.001054}, "text": "bmw golf prize money payout"}]	"en": 0.594428, "fr": 0.167891, "de": 0.157837, "ro": 0.029873, "nl": 0.01929, "pl": 0.019175, "sr-Latn": 0.003307, "cs": 0.00203, "pt-PT": 0.001809, "af": 0.001054	0	en-GB	northeurope	en: 0.594428, fr: 0.167891, de: 0.157837, ro: 0.029873, nl: 0.01929, pl: 0.019175, sr-Latn: 0.003307, cs: 0.00203, pt-PT: 0.001809, af: 0.001054	1	1	1	0	7			1	1	7	7	1	1	en	en	This query is likely interested in recent web pages. Please think about if the document is recent enough to be a good match for the user’s needs.	The user likely wants documents that are recent. Please pay attention to dates in the Result page. Assume the query was typed in just now.	f823bc67-7172-40dd-8143-d13e0f9eea04	2024-08-26T12:01:03.0000000+00:00	en-GB	1
a6a44b95-bf7c-4beb-b0b1-68ae9767b158	de-DE	[Lat:49.597599029541][Long:6.12639999389648][Town:Luxembourg,Luxembourg][PostCode:00000][IsGps:true]nippon billion steel takeover bid is	1		de-DE	premium		de	DE	de-DE		28BE6CCBE3AB643D2555782CE2D06581	00BD1C46540D44749512914DBDE30804	nippon billion steel takeover bid is	49.597599029541	6.12639999389648	Luxembourg	Luxembourg	Luxembourg	STARH1		-1	8/26/2024 1:10:08 AM	-1	0	-1	0	0	1	[{"predictions": {"en": 0.784252, "nl": 0.186356, "da": 0.022193, "nb": 0.001953, "sv": 0.001832, "af": 0.001069, "is": 0.000655, "mt": 0.000452, "de": 0.000403, "fil": 0.000275}, "text": "nippon billion steel takeover bid is"}]	"en": 0.784252, "nl": 0.186356, "da": 0.022193, "nb": 0.001953, "sv": 0.001832, "af": 0.001069, "is": 0.000655, "mt": 0.000452, "de": 0.000403, "fil": 0.000275	0	de-DE	northeurope	en: 0.784252, nl: 0.186356, da: 0.022193, nb: 0.001953, sv: 0.001832, af: 0.001069, is: 0.000655, mt: 0.000452, de: 0.000403, fil: 0.000275	0	0	0	0	9			1	0	9	0	1	1	de	en	Diese Suchanfrage ist vermutlich an aktuellen Webseiten interessiert. Bitte überlegen Sie, ob das Dokument aktuell genug ist, um die Bedürfnisse des Nutzers zufriedenzustellen.	Der Nutzer möchte vermutlich Dokumente, die aktuell sind. Bitte beachten Sie daher auch die Datumsangaben auf der Ergebnisseite. Gehen Sie davon aus, dass die Suchanfrage soeben erst eingegeben wurde.	f823bc67-7172-40dd-8143-d13e0f9eea04	2024-08-26T12:01:03.0000000+00:00	de-DE	0
