id	market	text	weight	userAgent	trueMarket	trafficPriority	urlAugmentation	uiLanguage	uiRegion	judgeMarket	anid	muid	impressionguid	querytext	lat	lng	city	state	country	formcode	formcodename	formcodeisorganic	requesttime	nrtpopulationfreq	historicalpopulationfreq	populationfreq	decile	isoverall	source	logquerylanguage	querylanguagepredictionhumpbackv1	isloglocation	judgemarket	datacenter	querylanguageprediction	superfresh	googletimestampsuperfresh	bingpostwebsuperfresh	constanthead	googletimestampcount	bingnewsanswercount	googlenewsanswercount	freshgoogle365	superfreshgoogle365	googletimestamplessthan365dayscount	googletimestamplessthan7dayscount	implicittemporal	forbvbusage	judgelanguage	querylanguage	intent	results	nrt_query_set_id	nrt_sampling_start_time	truemarket	isseasonalfresh
a87d4fb9-a94c-4361-bf20-d9fb8ae828d3	en-US	[Lat:37.32529830932617][Long:-121.8363037109375][Town:San Jose,California][PostCode:00000][IsGps:true]iesrael+news	1		en-US	premium		en	US	en-US			00D8F32C411F4DA690C9D05D4D0782E0	iesrael+news	37.32529830932617	-121.8363037109375	San Jose	California	United States	QBLH	Homepage Query Box - Flight 0 - Web	0	8/26/2024 2:39:53 AM	-1	0	-1	1	0	1	[{"predictions": {"en": 0.900378, "es": 0.045024, "ro": 0.021993, "nl": 0.012851, "af": 0.007266, "de": 0.003564, "ca": 0.001743, "pt-PT": 0.00123, "pl": 0.001214, "ms": 0.00056}, "text": "iesrael+news"}]	"en": 0.900378, "es": 0.045024, "ro": 0.021993, "nl": 0.012851, "af": 0.007266, "de": 0.003564, "ca": 0.001743, "pt-PT": 0.00123, "pl": 0.001214, "ms": 0.00056	1	en-US	eastus	en: 0.900378, es: 0.045024, ro: 0.021993, nl: 0.012851, af: 0.007266, de: 0.003564, ca: 0.001743, pt-PT: 0.00123, pl: 0.001214, ms: 0.00056	1	1	1	0	7			1	1	7	7	1	1	en	en	This query is likely interested in recent web pages. Please think about if the document is recent enough to be a good match for the user’s needs.	The user likely wants documents that are recent. Please pay attention to dates in the Result page. Assume the query was typed in just now.	f823bc67-7172-40dd-8143-d13e0f9eea04	2024-08-26T12:01:03.0000000+00:00	en-US	0
a9158039-89d0-4148-961f-548cc50268ca	ar-EG	[Lat:30.54789924621582][Long:31.139999389648438][Town:Markaz Qowesna,Al Minufiyah][PostCode:00000][IsGps:true]سعر الكتكوت الأبيض اليوم	1		ar-EG	costoptimized		ar	EG	ar-EG		25BFDAAB0D8965CA3143CB0F0CF564BB	F80B09D7A243491993FEDA3A1CFC6EEA	سعر الكتكوت الأبيض اليوم	30.54789924621582	31.139999389648438	Markaz Qowesna	Al Minufiyah	Egypt	HWMBFC		-1	8/26/2024 12:31:50 AM	-1	15	14	2	1	1	[{"predictions": {"ar": 1.0}, "text": "سعر الكتكوت الأبيض اليوم"}]	"ar": 1.0	1	ar-EG	northeurope	ar: 1	1	1	0	0	5			1	1	5	5	1	1	ar	ar	من المحتمل أن يكون هذا الاستعلام مهتمًا بصفحات الويب الحديثة. الرجاء التفكير فيما إذا كان المستند حديثًا بما يكفي ليطابق احتياجات المستخدم 	من المحتمل أن يرغب المستخدم في مستندات حديثة. يرجى الانتباه إلى التواريخ في صفحة النتائج. مع افتراض ان البحث قد كتب للتو	f823bc67-7172-40dd-8143-d13e0f9eea04	2024-08-26T12:01:03.0000000+00:00	ar-EG	1
af625ed5-f999-4b89-ac7d-b4b68d5dece1	fr-FR	[Lat:45.75490188598633][Long:4.8292999267578125][Town:Lyon,Auvergne-Rhone-Alpes][PostCode:00000][IsGps:true]major in rfid cards allows instant	1		fr-FR	premium		fr	FR	fr-FR			0038801BF9484F719918D5D416788A68	major in rfid cards allows instant	45.75490188598633	4.8292999267578125	Lyon	Auvergne-Rhone-Alpes	France	QBRE	top query box onresults page	0	8/26/2024 2:07:38 AM	-1	0	-1	0	0	1	[{"predictions": {"en": 0.997004, "nl": 0.002275, "ca": 0.000562, "fr": 7.2e-05, "ro": 4.9e-05, "de": 1.4e-05, "sv": 1e-05, "pt-PT": 4e-06, "id": 2e-06, "mt": 2e-06}, "text": "major in rfid cards allows instant"}]	"en": 0.997004, "nl": 0.002275, "ca": 0.000562, "fr": 7.2e-05, "ro": 4.9e-05, "de": 1.4e-05, "sv": 1e-05, "pt-PT": 4e-06, "id": 2e-06, "mt": 2e-06	1	fr-FR	northeurope	en: 0.997004, nl: 0.002275, ca: 0.000562, fr: 7.2E-05, ro: 4.9E-05, de: 1.4E-05, sv: 1E-05, pt-PT: 4E-06, id: 2E-06, mt: 2E-06	1	1	1	0	6			1	1	6	6	0	1	fr	en	L'utilisateur va probablement privilégier des résultats publiés récemment.  Pour évaluer la pertinence d'un résultat, prenez en compte sa date de publication.	L'utilisateur recherche probablement des résultats récents. Soyez attentif aux dates de publication et de mise à jour de la page de résultat.  Évaluez les résultats comme si la requête venait d'être effectuée.	f823bc67-7172-40dd-8143-d13e0f9eea04	2024-08-26T12:01:03.0000000+00:00	fr-FR	0
b06cb172-2812-4dee-9a07-88ff1df92107	en-US	[Lat:39.635799407959][Long:-89.0031967163086][Town:Moweaqua,IL][PostCode:00000][IsGps:true]colorado republicans vote party following antigay	1		en-US	premium		en	US	en-US			006B93D549FD4E7B98A1D22222013FC3	colorado republicans vote party following antigay	39.635799407959	-89.0031967163086	Moweaqua	IL	United States	s:web:null	Missing form code where vertical is web and referrer is null	0	8/26/2024 2:22:35 AM	-1	0	-1	0	0	1	[{"predictions": {"en": 0.93291, "es": 0.040312, "pt-PT": 0.019328, "ro": 0.001704, "fr": 0.001509, "de": 0.001495, "it": 0.001379, "ca": 0.00042, "gl": 0.000418, "sv": 0.000128}, "text": "colorado republicans vote party following antigay"}]	"en": 0.93291, "es": 0.040312, "pt-PT": 0.019328, "ro": 0.001704, "fr": 0.001509, "de": 0.001495, "it": 0.001379, "ca": 0.00042, "gl": 0.000418, "sv": 0.000128	0	en-US	westus	en: 0.93291, es: 0.040312, pt-PT: 0.019328, ro: 0.001704, fr: 0.001509, de: 0.001495, it: 0.001379, ca: 0.00042, gl: 0.000418, sv: 0.000128	1	1	1	0	8			1	1	8	3	0	1	en	en	This query is likely interested in recent web pages. Please think about if the document is recent enough to be a good match for the user’s needs.	The user likely wants documents that are recent. Please pay attention to dates in the Result page. Assume the query was typed in just now.	f823bc67-7172-40dd-8143-d13e0f9eea04	2024-08-26T12:01:03.0000000+00:00	en-US	0
b0dc108f-01e8-490a-87e8-0b2c42d69314	es-ES	[Lat:40.47129821777344][Long:-3.6946001052856445][Town:Madrid,Community Of Madrid][PostCode:00000][IsGps:true]antena 3 encierros sanse	1		es-ES	premium		es	ES	es-ES			05F390A217324571B6F2FDB06F22FCC5	antena 3 encierros sanse	40.47129821777344	-3.6946001052856445	Madrid	Community Of Madrid	Spain	ANNH01		-1	8/26/2024 1:55:24 AM	-1	1	0	1	0	1	[{"predictions": {"es": 0.99358, "gl": 0.005451, "ca": 0.000646, "fr": 0.000194, "pt-PT": 6.4e-05, "en": 4.7e-05, "nl": 9e-06, "fi": 2e-06, "de": 2e-06, "sv": 1e-06}, "text": "antena 3 encierros sanse"}]	"es": 0.99358, "gl": 0.005451, "ca": 0.000646, "fr": 0.000194, "pt-PT": 6.4e-05, "en": 4.7e-05, "nl": 9e-06, "fi": 2e-06, "de": 2e-06, "sv": 1e-06	1	es-ES	northeurope	es: 0.99358, gl: 0.005451, ca: 0.000646, fr: 0.000194, pt-PT: 6.4E-05, en: 4.7E-05, nl: 9E-06, fi: 2E-06, de: 2E-06, sv: 1E-06	1	1	1	0	6			1	1	6	3	1	1	es	es	Esta consulta probablemente esté enfocada en páginas web recientes. Piense si el documento es lo suficientemente reciente como para que coincida con las necesidades del usuario	Es probable que el usuario quiera documentos que sean recientes. Preste atención a las fechas en la página de resultados. Supongamos que la consulta se escribió hace un momento.	f823bc67-7172-40dd-8143-d13e0f9eea04	2024-08-26T12:01:03.0000000+00:00	es-ES	0
b4162ad3-208e-48b2-bf1e-37b29fb14c79	en-US	[Lat:39.3254013061523][Long:-84.6346969604492][Town:Hamilton,OH][PostCode:00000][IsGps:true]trump campaign group the ones	1		en-US	premium		en	US	en-US		1F67F3522A5863B71F14E7B42BC162D8	FF843C81D4A0497593F9F87990DEBB29	trump campaign group the ones	39.3254013061523	-84.6346969604492	Hamilton	OH	United States	s:web:null	Missing form code where vertical is web and referrer is null	0	8/26/2024 1:25:52 AM	-1	0	-1	0	1	1	[{"predictions": {"en": 0.999936, "vi": 3.7e-05, "ca": 1.3e-05, "fi": 7e-06, "nl": 4e-06, "id": 1e-06, "et": 1e-06, "de": 1e-06}, "text": "trump campaign group the ones"}]	"en": 0.999936, "vi": 3.7e-05, "ca": 1.3e-05, "fi": 7e-06, "nl": 4e-06, "id": 1e-06, "et": 1e-06, "de": 1e-06	0	en-US	eastus	en: 0.999936, vi: 3.7E-05, ca: 1.3E-05, fi: 7E-06, nl: 4E-06, id: 1E-06, et: 1E-06, de: 1E-06	1	1	1	0	6			1	1	6	5	1	1	en	en	This query is likely interested in recent web pages. Please think about if the document is recent enough to be a good match for the user’s needs.	The user likely wants documents that are recent. Please pay attention to dates in the Result page. Assume the query was typed in just now.	f823bc67-7172-40dd-8143-d13e0f9eea04	2024-08-26T12:01:03.0000000+00:00	en-US	0
b52fe593-5e8b-48e0-baa3-a2f1e0f885d7	en-CA	[Lat:49.29159927368164][Long:-123.05660247802734][Town:Vancouver,British Columbia][PostCode:00000][IsGps:true]explains spectacular how uk rocket test	1		en-CA	premium		en	CA	en-CA		2D565AA230F2612524024E4431A260F5	003EAC646DDB491E92FD707D6FCD0D05	explains spectacular how uk rocket test	49.29159927368164	-123.05660247802734	Vancouver	British Columbia	Canada	s:web:null	Missing form code where vertical is web and referrer is null	0	8/26/2024 12:31:10 AM	-1	0	-1	0	0	1	[{"predictions": {"en": 0.991525, "nl": 0.005433, "fr": 0.00277, "id": 0.000154, "ca": 3.7e-05, "lb": 3.5e-05, "da": 2.1e-05, "sv": 6e-06, "af": 5e-06, "ro": 4e-06}, "text": "explains spectacular how uk rocket test"}]	"en": 0.991525, "nl": 0.005433, "fr": 0.00277, "id": 0.000154, "ca": 3.7e-05, "lb": 3.5e-05, "da": 2.1e-05, "sv": 6e-06, "af": 5e-06, "ro": 4e-06	1	en-CA	northcentralus	en: 0.991525, nl: 0.005433, fr: 0.00277, id: 0.000154, ca: 3.7E-05, lb: 3.5E-05, da: 2.1E-05, sv: 6E-06, af: 5E-06, ro: 4E-06	1	1	1	0	8			1	1	8	8	1	1	en	en	This query is likely interested in recent web pages. Please think about if the document is recent enough to be a good match for the user’s needs.	The user likely wants documents that are recent. Please pay attention to dates in the Result page. Assume the query was typed in just now.	f823bc67-7172-40dd-8143-d13e0f9eea04	2024-08-26T12:01:03.0000000+00:00	en-CA	0
bb37df14-ec99-4820-8a09-cf4ba1241966	zh-CN	[Lat:39.907798767089844][Long:116.39759826660156][Town:Haidian District,Beijing][PostCode:00000][IsGps:true]huawei mate 70	1		zh-CN	premium		en	CN	en-IN		14791E8D89716D2A0EE70D4F88796C4A	FFA0E032DAAF46DD9D1D21D1447CB969	huawei mate 70	39.907798767089844	116.39759826660156	Haidian District	Beijing	China	CHROMN	FC for Chrome Omnibox	0	8/26/2024 12:26:12 AM	-1	279	278	4	1	1	[{"predictions": {"en": 0.632462, "es": 0.128241, "fr": 0.076694, "ms": 0.023608, "de": 0.018071, "vi": 0.016606, "ro": 0.016031, "id": 0.015768, "sw": 0.014587, "it": 0.010326}, "text": "huawei mate 70"}]	"en": 0.632462, "es": 0.128241, "fr": 0.076694, "ms": 0.023608, "de": 0.018071, "vi": 0.016606, "ro": 0.016031, "id": 0.015768, "sw": 0.014587, "it": 0.010326	1	en-IN	koreasouth	en: 0.632462, es: 0.128241, fr: 0.076694, ms: 0.023608, de: 0.018071, vi: 0.016606, ro: 0.016031, id: 0.015768, sw: 0.014587, it: 0.010326	1	0	1	0	6			1	0	6	1	1	1	en	en	This query is likely interested in recent web pages. Please think about if the document is recent enough to be a good match for the user’s needs.	The user likely wants documents that are recent. Please pay attention to dates in the Result page. Assume the query was typed in just now.	f823bc67-7172-40dd-8143-d13e0f9eea04	2024-08-26T12:01:03.0000000+00:00	zh-CN	0
bd8f0f03-9011-4bd3-b292-57a4d06cac93	de-DE	[Lat:52.472599029541016][Long:13.449399948120117][Town:Berlin,Berlin][PostCode:00000][IsGps:true]the pirate bay tv teaser appears	1		de-DE	premium		de	DE	de-DE		0ADBAFB14BCD61E40B94BB574A36600D	0060EE31551A4F5B99E56AD3EA706D2B	the pirate bay tv teaser appears	52.472599029541016	13.449399948120117	Berlin	Berlin	Germany	s:web:null	Missing form code where vertical is web and referrer is null	0	8/26/2024 12:02:54 AM	-1	0	-1	1	0	1	[{"predictions": {"en": 0.999817, "nl": 0.000101, "nb": 6.3e-05, "et": 4e-06, "fr": 3e-06, "fi": 3e-06, "pt-PT": 3e-06, "da": 1e-06, "vi": 1e-06, "de": 1e-06}, "text": "the pirate bay tv teaser appears"}]	"en": 0.999817, "nl": 0.000101, "nb": 6.3e-05, "et": 4e-06, "fr": 3e-06, "fi": 3e-06, "pt-PT": 3e-06, "da": 1e-06, "vi": 1e-06, "de": 1e-06	1	de-DE	northeurope	en: 0.999817, nl: 0.000101, nb: 6.3E-05, et: 4E-06, fr: 3E-06, fi: 3E-06, pt-PT: 3E-06, da: 1E-06, vi: 1E-06, de: 1E-06	1	1	1	0	7			1	1	7	7	0	1	de	en	Diese Suchanfrage ist vermutlich an aktuellen Webseiten interessiert. Bitte überlegen Sie, ob das Dokument aktuell genug ist, um die Bedürfnisse des Nutzers zufriedenzustellen.	Der Nutzer möchte vermutlich Dokumente, die aktuell sind. Bitte beachten Sie daher auch die Datumsangaben auf der Ergebnisseite. Gehen Sie davon aus, dass die Suchanfrage soeben erst eingegeben wurde.	f823bc67-7172-40dd-8143-d13e0f9eea04	2024-08-26T12:01:03.0000000+00:00	de-DE	0
c10a9e19-23e3-4bcd-873f-5a0189b589a4	fr-FR	[Lat:48.9001998901367][Long:2.17980003356934][Town:Nanterre,Île-de-France][PostCode:00000][IsGps:true]docs à corps perdus	1		fr-FR	premium		fr	FR	fr-FR			0073BA5C26A84FF7AAF2F2E643735C49	docs à corps perdus	48.9001998901367	2.17980003356934	Nanterre	Île-de-France	France	ANNNB1		-1	8/26/2024 2:49:08 AM	-1	0	-1	0	0	1	[{"predictions": {"fr": 0.972801, "ca": 0.025119, "lb": 0.001893, "en": 0.000165, "pt-PT": 1.6e-05, "ro": 3e-06, "gl": 2e-06, "nl": 1e-06, "it": 1e-06}, "text": "docs à corps perdus"}]	"fr": 0.972801, "ca": 0.025119, "lb": 0.001893, "en": 0.000165, "pt-PT": 1.6e-05, "ro": 3e-06, "gl": 2e-06, "nl": 1e-06, "it": 1e-06	0	fr-FR	northeurope	fr: 0.972801, ca: 0.025119, lb: 0.001893, en: 0.000165, pt-PT: 1.6E-05, ro: 3E-06, gl: 2E-06, nl: 1E-06, it: 1E-06	1	1	1	0	7			1	1	7	6	0	1	fr	fr	L'utilisateur va probablement privilégier des résultats publiés récemment.  Pour évaluer la pertinence d'un résultat, prenez en compte sa date de publication.	L'utilisateur recherche probablement des résultats récents. Soyez attentif aux dates de publication et de mise à jour de la page de résultat.  Évaluez les résultats comme si la requête venait d'être effectuée.	f823bc67-7172-40dd-8143-d13e0f9eea04	2024-08-26T12:01:03.0000000+00:00	fr-FR	0
c40b7fea-77e1-47d9-8c98-0fd7589ba9ab	en-IN	[Lat:17.5041007995605][Long:78.1334991455078][Town:Kandi,TG][PostCode:00000][IsGps:true]nagarjuna convention hall news	1		en-IN	premium		en	IN	en-IN	A748C8514AA5892C9B543CD6FFFFFFFF	1F6740B7919C64900DC754C69074652F	00E96DADE18B4DD8987493C87D127389	nagarjuna convention hall news	17.5041007995605	78.1334991455078	Kandi	TG	India	ANNTA1		-1	8/26/2024 12:32:34 AM	-1	0	-1	1	0	1	[{"predictions": {"en": 0.715819, "mt": 0.118092, "sv": 0.101661, "fil": 0.051267, "ms": 0.002636, "et": 0.002118, "sw": 0.001211, "fr": 0.001168, "fi": 0.001138, "id": 0.001111}, "text": "nagarjuna convention hall news"}]	"en": 0.715819, "mt": 0.118092, "sv": 0.101661, "fil": 0.051267, "ms": 0.002636, "et": 0.002118, "sw": 0.001211, "fr": 0.001168, "fi": 0.001138, "id": 0.001111	0	en-IN	koreasouth	en: 0.715819, mt: 0.118092, sv: 0.101661, fil: 0.051267, ms: 0.002636, et: 0.002118, sw: 0.001211, fr: 0.001168, fi: 0.001138, id: 0.001111	1	1	1	0	8			1	1	8	8	1	1	en	en	This query is likely interested in recent web pages. Please think about if the document is recent enough to be a good match for the user’s needs.	The user likely wants documents that are recent. Please pay attention to dates in the Result page. Assume the query was typed in just now.	f823bc67-7172-40dd-8143-d13e0f9eea04	2024-08-26T12:01:03.0000000+00:00	en-IN	0
c53212c6-9fbd-48b0-bbf9-e3c4aa0a6148	fr-FR	[Lat:48.8305015563965][Long:-0.101700000464916][Town:Nécy,Normandy][PostCode:00000][IsGps:true]says spacex will bring starliner astronauts	1		fr-FR	premium		fr	FR	fr-FR		15B10C898A5A6DE223B0186F8B8C6C75	FF6BC2D674284BD0993FDA27B69E921B	says spacex will bring starliner astronauts	48.8305015563965	-0.101700000464916	Nécy	Normandy	France	s:web:null	Missing form code where vertical is web and referrer is null	0	8/26/2024 1:11:26 AM	-1	0	-1	1	1	1	[{"predictions": {"en": 0.997673, "fr": 0.000811, "de": 0.00063, "sv": 0.000343, "id": 0.000279, "lb": 0.000112, "nl": 4.5e-05, "nb": 3.4e-05, "ms": 2.4e-05, "pt-PT": 1e-05}, "text": "says spacex will bring starliner astronauts"}]	"en": 0.997673, "fr": 0.000811, "de": 0.00063, "sv": 0.000343, "id": 0.000279, "lb": 0.000112, "nl": 4.5e-05, "nb": 3.4e-05, "ms": 2.4e-05, "pt-PT": 1e-05	0	fr-FR	northeurope	en: 0.997673, fr: 0.000811, de: 0.00063, sv: 0.000343, id: 0.000279, lb: 0.000112, nl: 4.5E-05, nb: 3.4E-05, ms: 2.4E-05, pt-PT: 1E-05	1	1	1	0	8			1	1	8	8	0	1	fr	en	L'utilisateur va probablement privilégier des résultats publiés récemment.  Pour évaluer la pertinence d'un résultat, prenez en compte sa date de publication.	L'utilisateur recherche probablement des résultats récents. Soyez attentif aux dates de publication et de mise à jour de la page de résultat.  Évaluez les résultats comme si la requête venait d'être effectuée.	f823bc67-7172-40dd-8143-d13e0f9eea04	2024-08-26T12:01:03.0000000+00:00	fr-FR	0
c86deb04-4b21-45bc-a4b0-db01ff13420a	en-US	[Lat:40.75979995727539][Long:-73.98059844970703][Town:New York,New York][PostCode:00000][IsGps:true]big damage island brings heavy rain	1		en-US	premium		ru	US	ru-RU		0A9952A2BA0E6F5126FE4644BB666E47	0253B7D3DA2145BC9A1BB639811BA838	big damage island brings heavy rain	40.75979995727539	-73.98059844970703	New York	New York	United States	s:web:null	Missing form code where vertical is web and referrer is null	0	8/26/2024 1:29:48 AM	-1	0	-1	0	0	1	[{"predictions": {"en": 0.999674, "nl": 0.000258, "fil": 1.9e-05, "fr": 1.6e-05, "sv": 8e-06, "et": 5e-06, "af": 5e-06, "de": 4e-06, "id": 2e-06, "ro": 2e-06}, "text": "big damage island brings heavy rain"}]	"en": 0.999674, "nl": 0.000258, "fil": 1.9e-05, "fr": 1.6e-05, "sv": 8e-06, "et": 5e-06, "af": 5e-06, "de": 4e-06, "id": 2e-06, "ro": 2e-06	1	ru-RU	northcentralus	en: 0.999674, nl: 0.000258, fil: 1.9E-05, fr: 1.6E-05, sv: 8E-06, et: 5E-06, af: 5E-06, de: 4E-06, id: 2E-06, ro: 2E-06	1	1	1	0	7			1	1	7	7	1	1	ru	en	Возможно, этот поисковый запрос заинтересован в самых свежих веб-страницах. Пожалуйста, удостоверьтесь, что документ достаточно свежий, чтобы соответствовать потребностям пользователя.	Пользователь, скорее всего, хочет увидеть новейшие результаты поиска. Пожалуйста, обращайте внимание на даты на страницах результатов (вкладка Results). Исходите из того, что запрос был введен только что	f823bc67-7172-40dd-8143-d13e0f9eea04	2024-08-26T12:01:03.0000000+00:00	en-US	0
c881ea22-61e7-4ea1-bf2b-09ea3f2b68f9	es-ES	[Lat:39.47779846191406][Long:-0.36309999227523804][Town:Valencia,Valencian Community][PostCode:00000][IsGps:true]torneo tramos de elo albacete	1		es-ES	premium		es	ES	es-ES			000DD78B550942D9B0D338B3842C5D4E	torneo tramos de elo albacete	39.47779846191406	-0.36309999227523804	Valencia	Valencian Community	Spain	ANNTH1		-1	8/26/2024 2:30:43 AM	-1	0	-1	0	0	1	[{"predictions": {"es": 0.586595, "pt-PT": 0.2204, "gl": 0.192679, "ca": 0.00031, "ro": 1.5e-05, "en": 1e-06}, "text": "torneo tramos de elo albacete"}]	"es": 0.586595, "pt-PT": 0.2204, "gl": 0.192679, "ca": 0.00031, "ro": 1.5e-05, "en": 1e-06	1	es-ES	northeurope	es: 0.586595, pt-PT: 0.2204, gl: 0.192679, ca: 0.00031, ro: 1.5E-05, en: 1E-06	1	1	1	0	5			1	1	5	3	1	1	es	es	Esta consulta probablemente esté enfocada en páginas web recientes. Piense si el documento es lo suficientemente reciente como para que coincida con las necesidades del usuario	Es probable que el usuario quiera documentos que sean recientes. Preste atención a las fechas en la página de resultados. Supongamos que la consulta se escribió hace un momento.	f823bc67-7172-40dd-8143-d13e0f9eea04	2024-08-26T12:01:03.0000000+00:00	es-ES	0
c9cb0fca-454c-4898-80e4-9ebeb1fae5e3	fr-FR	[Lat:47.3061981201172][Long:3.07489991188049][Town:Suilly-la-Tour,Bourgogne-Franche-Comté][PostCode:00000][IsGps:true]hackers have entirely way to backdoor	1		fr-FR	premium		fr	FR	fr-FR			00F986E0B4204277945789AFBEACB5EB	hackers have entirely way to backdoor	47.3061981201172	3.07489991188049	Suilly-la-Tour	Bourgogne-Franche-Comté	France	s:web:null	Missing form code where vertical is web and referrer is null	0	8/26/2024 1:42:39 AM	-1	0	-1	1	0	1	[{"predictions": {"en": 0.999893, "nl": 8.4e-05, "de": 1.8e-05, "hu": 3e-06, "da": 1e-06}, "text": "hackers have entirely way to backdoor"}]	"en": 0.999893, "nl": 8.4e-05, "de": 1.8e-05, "hu": 3e-06, "da": 1e-06	0	fr-FR	northeurope	en: 0.999893, nl: 8.4E-05, de: 1.8E-05, hu: 3E-06, da: 1E-06	1	1	1	0	6			1	1	6	3	0	1	fr	en	L'utilisateur va probablement privilégier des résultats publiés récemment.  Pour évaluer la pertinence d'un résultat, prenez en compte sa date de publication.	L'utilisateur recherche probablement des résultats récents. Soyez attentif aux dates de publication et de mise à jour de la page de résultat.  Évaluez les résultats comme si la requête venait d'être effectuée.	f823bc67-7172-40dd-8143-d13e0f9eea04	2024-08-26T12:01:03.0000000+00:00	fr-FR	0
cad35a85-5707-4404-acf4-8c913a20ee88	en-US	[Lat:42.37590026855469][Long:-72.5114974975586][Town:Pelham,Massachusetts][PostCode:00000][IsGps:true]will boeing launch a starliner spacecraf	1		en-US	premium		en	US	en-US	876DDFB29EE395C71EF37077FFFFFFFF	23C019F0939466C11E340DF3924C679D	00518C4423014C42B6428CD46490EC87	will boeing launch a starliner spacecraf	42.37590026855469	-72.5114974975586	Pelham	Massachusetts	United States	QBRE	top query box onresults page	0	8/26/2024 1:19:03 AM	-1	0	-1	0	0	1	[{"predictions": {"en": 0.992492, "de": 0.00474, "lb": 0.002678, "pl": 5.4e-05, "nl": 2.6e-05, "fr": 3e-06, "ro": 2e-06, "sv": 2e-06, "id": 1e-06}, "text": "will boeing launch a starliner spacecraf"}]	"en": 0.992492, "de": 0.00474, "lb": 0.002678, "pl": 5.4e-05, "nl": 2.6e-05, "fr": 3e-06, "ro": 2e-06, "sv": 2e-06, "id": 1e-06	1	en-US	eastus	en: 0.992492, de: 0.00474, lb: 0.002678, pl: 5.4E-05, nl: 2.6E-05, fr: 3E-06, ro: 2E-06, sv: 2E-06, id: 1E-06	1	1	0	0	5			1	0	5	2	1	1	en	en	This query is likely interested in recent web pages. Please think about if the document is recent enough to be a good match for the user’s needs.	The user likely wants documents that are recent. Please pay attention to dates in the Result page. Assume the query was typed in just now.	f823bc67-7172-40dd-8143-d13e0f9eea04	2024-08-26T12:01:03.0000000+00:00	en-US	0
ccc013da-ae9a-4a4c-8141-b184ef6fca8e	de-DE	[Lat:50.07360076904297][Long:8.75629997253418][Town:Offenbach,Hesse][PostCode:00000][IsGps:true]aktuellstes ios 17	1		de-DE	premium		de	DE	de-DE			00A8D7C670574F7D9B15068B11E0C1E8	aktuellstes ios 17	50.07360076904297	8.75629997253418	Offenbach	Hesse	Germany	QBRE	top query box onresults page	0	8/26/2024 2:33:50 AM	-1	0	-1	0	0	1	[{"predictions": {"de": 0.753046, "sv": 0.151557, "en": 0.028882, "lv": 0.017533, "da": 0.015475, "nb": 0.010653, "et": 0.007343, "lb": 0.002772, "ca": 0.0027, "lt": 0.002505}, "text": "aktuellstes ios 17"}]	"de": 0.753046, "sv": 0.151557, "en": 0.028882, "lv": 0.017533, "da": 0.015475, "nb": 0.010653, "et": 0.007343, "lb": 0.002772, "ca": 0.0027, "lt": 0.002505	1	de-DE	northeurope	de: 0.753046, sv: 0.151557, en: 0.028882, lv: 0.017533, da: 0.015475, nb: 0.010653, et: 0.007343, lb: 0.002772, ca: 0.0027, lt: 0.002505	0	0	0	0	5			1	0	5	0	1	1	de	de	Diese Suchanfrage ist vermutlich an aktuellen Webseiten interessiert. Bitte überlegen Sie, ob das Dokument aktuell genug ist, um die Bedürfnisse des Nutzers zufriedenzustellen.	Der Nutzer möchte vermutlich Dokumente, die aktuell sind. Bitte beachten Sie daher auch die Datumsangaben auf der Ergebnisseite. Gehen Sie davon aus, dass die Suchanfrage soeben erst eingegeben wurde.	f823bc67-7172-40dd-8143-d13e0f9eea04	2024-08-26T12:01:03.0000000+00:00	de-DE	0
cf3f8453-d1e2-4f86-8965-8ab37461dec7	zh-CN	[Lat:43.87379837036133][Long:125.38899993896484][Town:Erdao District,Jilin][PostCode:00000][IsGps:true]白上市地图	1		zh-CN	premium		zh	CN	zh-CN			001571D73DF740CFAC728A21B9A23A8C	白上市地图	43.87379837036133	125.38899993896484	Erdao District	Jilin	China	ANNH01		-1	8/26/2024 1:56:13 AM	-1	0	-1	0	0	1	[{"predictions": {"zh-Hans": 0.999065, "zh-Hant": 0.00092, "ko": 1.5e-05}, "text": "白上市地图"}]	"zh-Hans": 0.999065, "zh-Hant": 0.00092, "ko": 1.5e-05	1	zh-CN	koreasouth	zh-Hans: 0.999065, zh-Hant: 0.00092, ko: 1.5E-05	1	1	0	0	8			1	1	8	7	0	1	zh	zh-Hans	此查询可能对最近的网页感兴趣。 请考虑该文档是否足够新，可以满足用户的需求。	用户可能想要最近的文档。 请注意结果页面中的日期。 假设查询是刚才被输入的。	f823bc67-7172-40dd-8143-d13e0f9eea04	2024-08-26T12:01:03.0000000+00:00	zh-CN	0
