id	market	text	weight	userAgent	trueMarket	trafficPriority	urlAugmentation	uiLanguage	uiRegion	judgeMarket	anid	muid	impressionguid	querytext	lat	lng	city	state	country	formcode	formcodename	formcodeisorganic	requesttime	nrtpopulationfreq	historicalpopulationfreq	populationfreq	decile	isoverall	source	logquerylanguage	querylanguagepredictionhumpbackv1	isloglocation	judgemarket	datacenter	querylanguageprediction	superfresh	googletimestampsuperfresh	bingpostwebsuperfresh	constanthead	googletimestampcount	bingnewsanswercount	googlenewsanswercount	freshgoogle365	superfreshgoogle365	googletimestamplessthan365dayscount	googletimestamplessthan7dayscount	implicittemporal	forbvbusage	judgelanguage	querylanguage	intent	results	nrt_query_set_id	nrt_sampling_start_time	truemarket	isseasonalfresh
003f6994-6650-49a6-b57b-bdb202f00d09	fr-FR	[Lat:47.27429962158203][Long:-2.213900089263916][Town:St-Nazaire,Pays De La Loire][PostCode:00000][IsGps:true]spacex dawn why billionaire risking	1		fr-FR	premium		fr	FR	fr-FR			0184CF69620C422FBAA96779E8C01F86	spacex dawn why billionaire risking	47.27429962158203	-2.213900089263916	St-Nazaire	Pays De La Loire	France	s:web:null	Missing form code where vertical is web and referrer is null	0	8/26/2024 2:43:33 AM	-1	0	-1	0	0	1	[{"predictions": {"en": 0.993601, "sv": 0.002894, "mt": 0.000711, "af": 0.000596, "da": 0.000537, "nl": 0.000334, "vi": 0.00033, "fr": 0.000321, "nb": 0.000307, "lb": 7.9e-05}, "text": "spacex dawn why billionaire risking"}]	"en": 0.993601, "sv": 0.002894, "mt": 0.000711, "af": 0.000596, "da": 0.000537, "nl": 0.000334, "vi": 0.00033, "fr": 0.000321, "nb": 0.000307, "lb": 7.9e-05	1	fr-FR	northeurope	en: 0.993601, sv: 0.002894, mt: 0.000711, af: 0.000596, da: 0.000537, nl: 0.000334, vi: 0.00033, fr: 0.000321, nb: 0.000307, lb: 7.9E-05	1	1	1	0	9			1	1	9	9	0	1	fr	en	L'utilisateur va probablement privilégier des résultats publiés récemment.  Pour évaluer la pertinence d'un résultat, prenez en compte sa date de publication.	L'utilisateur recherche probablement des résultats récents. Soyez attentif aux dates de publication et de mise à jour de la page de résultat.  Évaluez les résultats comme si la requête venait d'être effectuée.	f823bc67-7172-40dd-8143-d13e0f9eea04	2024-08-26T12:01:03.0000000+00:00	fr-FR	0
0433fc9e-ddad-459e-9913-9f42c1cfcb6a	en-WW	[Lat:18.781600952148438][Long:99.00650024414062][Town:Chiang Mai,Chiang Mai][PostCode:00000][IsGps:true]ceo pavel durov services	1		th-TH	costoptimized		fr	TH	fr-FR			FF08138F2D46441BA534D4A3D2F2D003	ceo pavel durov services	18.781600952148438	99.00650024414062	Chiang Mai	Chiang Mai	Thailand	IESR4N	Browser Search Box, Address Bar	0	8/26/2024 2:40:25 AM	-1	0	-1	0	1	1	[{"predictions": {"en": 0.857228, "pt-PT": 0.052244, "ro": 0.03601, "es": 0.012089, "sk": 0.009702, "gl": 0.008119, "lv": 0.006976, "sl": 0.005486, "cs": 0.003076, "id": 0.002445}, "text": "ceo pavel durov services"}]	"en": 0.857228, "pt-PT": 0.052244, "ro": 0.03601, "es": 0.012089, "sk": 0.009702, "gl": 0.008119, "lv": 0.006976, "sl": 0.005486, "cs": 0.003076, "id": 0.002445	1	fr-FR	koreasouth	en: 0.857228, pt-PT: 0.052244, ro: 0.03601, es: 0.012089, sk: 0.009702, gl: 0.008119, lv: 0.006976, sl: 0.005486, cs: 0.003076, id: 0.002445	1	1	1	0	7			1	1	7	7	0	1	fr	en	L'utilisateur va probablement privilégier des résultats publiés récemment.  Pour évaluer la pertinence d'un résultat, prenez en compte sa date de publication.	L'utilisateur recherche probablement des résultats récents. Soyez attentif aux dates de publication et de mise à jour de la page de résultat.  Évaluez les résultats comme si la requête venait d'être effectuée.	f823bc67-7172-40dd-8143-d13e0f9eea04	2024-08-26T12:01:03.0000000+00:00	th-TH	0
044768f0-8f73-4968-b79d-17bb530e63fb	en-IN	[Lat:12.739800453186][Long:79.9046020507813][Town:,][PostCode:00000][IsGps:true]penny stock company list under 1 rs in nse india	1		en-IN	premium		en	IN	en-IN		2231CA39F7EF6DD33B26DEF6F6C16C6C	0039EFE75AE54792838408EF4831A56E	penny stock company list under 1 rs in nse india	12.739800453186	79.9046020507813				QBRE	top query box onresults page	0	8/26/2024 12:12:00 AM	-1	0	-1	0	0	1	[{"predictions": {"en": 0.999791, "id": 0.00018, "nl": 1.6e-05, "sw": 3e-06, "fil": 3e-06, "de": 2e-06, "ro": 2e-06, "ms": 1e-06, "fi": 1e-06}, "text": "penny stock company list under 1 rs in nse india"}]	"en": 0.999791, "id": 0.00018, "nl": 1.6e-05, "sw": 3e-06, "fil": 3e-06, "de": 2e-06, "ro": 2e-06, "ms": 1e-06, "fi": 1e-06	0	en-IN	koreasouth	en: 0.999791, id: 0.00018, nl: 1.6E-05, sw: 3E-06, fil: 3E-06, de: 2E-06, ro: 2E-06, ms: 1E-06, fi: 1E-06	0	0	0	0	5			1	0	5	2	1	1	en	en	This query is likely interested in recent web pages. Please think about if the document is recent enough to be a good match for the user’s needs.	The user likely wants documents that are recent. Please pay attention to dates in the Result page. Assume the query was typed in just now.	f823bc67-7172-40dd-8143-d13e0f9eea04	2024-08-26T12:01:03.0000000+00:00	en-IN	1
0c79272c-f7af-444d-86c9-f6941c0b86dc	en-IN	[Lat:1.31970000267029][Long:103.784698486328][Town:Bukit Timah,Central Region][PostCode:00000][IsGps:true]best video editors for mac	1		en-IN	premium		en	IN	en-IN			FFB585F18D5849D886B11E8E2AB2C52B	best video editors for mac	1.31970000267029	103.784698486328	Bukit Timah	Central Region	Singapore	CHROMN	FC for Chrome Omnibox	0	8/26/2024 2:25:14 AM	-1	41	40	3	1	1	[{"predictions": {"en": 0.998978, "pt-PT": 0.000547, "da": 0.000108, "ca": 8.9e-05, "nb": 6.6e-05, "de": 6.2e-05, "ro": 3.1e-05, "nl": 2.8e-05, "hu": 2.3e-05, "fr": 1.8e-05}, "text": "best video editors for mac"}]	"en": 0.998978, "pt-PT": 0.000547, "da": 0.000108, "ca": 8.9e-05, "nb": 6.6e-05, "de": 6.2e-05, "ro": 3.1e-05, "nl": 2.8e-05, "hu": 2.3e-05, "fr": 1.8e-05	0	en-IN	koreasouth	en: 0.998978, pt-PT: 0.000547, da: 0.000108, ca: 8.9E-05, nb: 6.6E-05, de: 6.2E-05, ro: 3.1E-05, nl: 2.8E-05, hu: 2.3E-05, fr: 1.8E-05	0	0	0	0	5			1	0	5	1	1	1	en	en	This query is likely interested in recent web pages. Please think about if the document is recent enough to be a good match for the user’s needs.	The user likely wants documents that are recent. Please pay attention to dates in the Result page. Assume the query was typed in just now.	f823bc67-7172-40dd-8143-d13e0f9eea04	2024-08-26T12:01:03.0000000+00:00	en-IN	1
13de147b-8c67-4006-8f5c-8a7793410f37	ar-SA	[Lat:21.8484001159668][Long:40.8098983764648][Town:,][PostCode:00000][IsGps:true]من صيغ الأمر : الفعل المضارع المقترن بلام الأمر الجازمة. صواب خطأ	1		ar-SA	full		ar	SA	ar-EG			02719798F27C4DD6B5195E479ACD1099	من صيغ الأمر : الفعل المضارع المقترن بلام الأمر الجازمة. صواب خطأ	21.8484001159668	40.8098983764648				HWMBFC		-1	8/26/2024 2:02:56 AM	-1	26	25	2	0	1	[{"predictions": {"ar": 1.0}, "text": "من صيغ الأمر : الفعل المضارع المقترن بلام الأمر الجازمة. صواب خطأ"}]	"ar": 1.0	0	ar-EG	northeurope	ar: 1	1	1	0	0	8			1	1	5	4	0	1	ar	ar	من المحتمل أن يكون هذا الاستعلام مهتمًا بصفحات الويب الحديثة. الرجاء التفكير فيما إذا كان المستند حديثًا بما يكفي ليطابق احتياجات المستخدم 	من المحتمل أن يرغب المستخدم في مستندات حديثة. يرجى الانتباه إلى التواريخ في صفحة النتائج. مع افتراض ان البحث قد كتب للتو	f823bc67-7172-40dd-8143-d13e0f9eea04	2024-08-26T12:01:03.0000000+00:00	ar-SA	0
154ca434-6ba0-4a9f-a298-2b705a7100c3	de-DE	[Lat:49.2279014587402][Long:10.0382995605469][Town:Rot am See,Baden-Württemberg][PostCode:00000][IsGps:true]augmentation evoker	1		de-DE	premium		de	DE	de-DE		3A6124F346E7656B37303075474D6438	FFAAB542062D401B9FFE8A76B9700283	augmentation evoker	49.2279014587402	10.0382995605469	Rot am See	Baden-Württemberg	Germany	ANNTA1		-1	8/26/2024 12:28:51 AM	-1	347	346	5	1	1	[{"predictions": {"de": 0.545925, "en": 0.38134, "fr": 0.035136, "nl": 0.018753, "nb": 0.00634, "sv": 0.005241, "lb": 0.00365, "sk": 0.001283, "cs": 0.001277, "da": 0.001055}, "text": "augmentation evoker"}]	"en": 0.76034, "de": 0.088499, "fr": 0.070057, "nl": 0.03739, "nb": 0.01264, "sv": 0.01045, "lb": 0.007277, "sk": 0.002559, "cs": 0.002545, "da": 0.002104	0	de-DE	northeurope	de: 0.545925, en: 0.38134, fr: 0.035136, nl: 0.018753, nb: 0.00634, sv: 0.005241, lb: 0.00365, sk: 0.001283, cs: 0.001277, da: 0.001055	1	1	0	0	5			1	1	5	4	0	1	de	de	Diese Suchanfrage ist vermutlich an aktuellen Webseiten interessiert. Bitte überlegen Sie, ob das Dokument aktuell genug ist, um die Bedürfnisse des Nutzers zufriedenzustellen.	Der Nutzer möchte vermutlich Dokumente, die aktuell sind. Bitte beachten Sie daher auch die Datumsangaben auf der Ergebnisseite. Gehen Sie davon aus, dass die Suchanfrage soeben erst eingegeben wurde.	f823bc67-7172-40dd-8143-d13e0f9eea04	2024-08-26T12:01:03.0000000+00:00	de-DE	0
158a79a4-dd5d-46c8-991f-605372b813af	en-GB	[Lat:51.6156005859375][Long:0.4392000138759613][Town:Crays Hill,Essex][PostCode:00000][IsGps:true]Rachel Reeves reported	1		en-GB	premium		en	GB	en-GB			FFACC118F980493AB902D5F5BF1B5AB3	Rachel Reeves reported	51.6156005859375	0.4392000138759613	Crays Hill	Essex	United Kingdom	AMZNUN	Amazon Fire Universal Search	0	8/26/2024 2:22:58 AM	-1	0	-1	1	1	1	[{"predictions": {"en": 0.922343, "pt-PT": 0.062714, "et": 0.004564, "da": 0.004003, "nl": 0.003816, "de": 0.000643, "fr": 0.00055, "es": 0.000504, "lb": 0.000343, "nb": 0.000186}, "text": "rachel reeves reported"}]	"en": 0.922343, "pt-PT": 0.062714, "et": 0.004564, "da": 0.004003, "nl": 0.003816, "de": 0.000643, "fr": 0.00055, "es": 0.000504, "lb": 0.000343, "nb": 0.000186	1	en-GB	northeurope	en: 0.922343, pt-PT: 0.062714, et: 0.004564, da: 0.004003, nl: 0.003816, de: 0.000643, fr: 0.00055, es: 0.000504, lb: 0.000343, nb: 0.000186	1	1	0	0	7			1	1	7	5	1	1	en	en	This query is likely interested in recent web pages. Please think about if the document is recent enough to be a good match for the user’s needs.	The user likely wants documents that are recent. Please pay attention to dates in the Result page. Assume the query was typed in just now.	f823bc67-7172-40dd-8143-d13e0f9eea04	2024-08-26T12:01:03.0000000+00:00	en-GB	0
16a40b15-ae6c-462c-8ff8-6744c98b4a2b	en-US	[Lat:30.631099700927734][Long:104.09429931640625][Town:Chengdu,Sichuan][PostCode:00000][IsGps:true]李娟回应与董宇辉对谈「不同频」，称「一坨」是常用量词，如何看待二人的本次对谈？	1		zh-CN	premium		en	US	en-IN	40E51AF841081CC41CD00D4DFFFFFFFF	29ED73AB50106DA30A9B6705514D6CFD	FFA4C4B1A90E45EBA21BFDB3BADD24DB	李娟回应与董宇辉对谈「不同频」，称「一坨」是常用量词，如何看待二人的本次对谈？	30.631099700927734	104.09429931640625	Chengdu	Sichuan	China	JDLF		-1	8/26/2024 1:15:49 AM	-1	0	-1	1	1	1	[{"predictions": {"zh-Hans": 0.998229, "zh-Hant": 0.001766, "ko": 4e-06}, "text": "李娟回应与董宇辉对谈「不同频」,称「一坨」是常用量词,如何看待二人的本次对谈?"}]	"zh-Hans": 0.998229, "zh-Hant": 0.001766, "ko": 4e-06	1	en-IN	eastus	zh-Hans: 0.998229, zh-Hant: 0.001766, ko: 4E-06	1	1	0	0	10			1	1	10	10	0	1	en	zh-Hans	This query is likely interested in recent web pages. Please think about if the document is recent enough to be a good match for the user’s needs.	The user likely wants documents that are recent. Please pay attention to dates in the Result page. Assume the query was typed in just now.	f823bc67-7172-40dd-8143-d13e0f9eea04	2024-08-26T12:01:03.0000000+00:00	zh-CN	0
1c24f695-8cec-488b-93c0-aed6a28022c1	en-US	[Lat:33.83259963989258][Long:-118.38600158691406][Town:Gardena,California][PostCode:00000][IsGps:true]OHTANI 40-40 RIGGED	1		en-US	premium		en	US	en-US			00D4A9CDDD1148FAB4BBEAFF9CD3945D	OHTANI 40-40 RIGGED	33.83259963989258	-118.38600158691406	Gardena	California	United States	ANNAB1		-1	8/26/2024 1:35:50 AM	-1	0	-1	1	0	1	[{"predictions": {"en": 0.651181, "et": 0.312348, "it": 0.016226, "mt": 0.009249, "sv": 0.004325, "tr": 0.002264, "da": 0.001377, "sq": 0.001181, "fi": 0.001045, "ms": 0.000804}, "text": "ohtani 40-40 rigged"}]	"et": 0.622951, "en": 0.298722, "it": 0.032361, "mt": 0.018445, "sv": 0.008627, "tr": 0.004514, "da": 0.002745, "sq": 0.002355, "fi": 0.002085, "ms": 0.001604	1	en-US	eastus	en: 0.651181, et: 0.312348, it: 0.016226, mt: 0.009249, sv: 0.004325, tr: 0.002264, da: 0.001377, sq: 0.001181, fi: 0.001045, ms: 0.000804	1	1	1	0	6			1	1	6	6	1	1	en	en	This query is likely interested in recent web pages. Please think about if the document is recent enough to be a good match for the user’s needs.	The user likely wants documents that are recent. Please pay attention to dates in the Result page. Assume the query was typed in just now.	f823bc67-7172-40dd-8143-d13e0f9eea04	2024-08-26T12:01:03.0000000+00:00	en-US	0
1c3d0fcf-1f86-411f-8121-2e92865100d2	de-DE	[Lat:53.8011016845703][Long:10.0746002197266][Town:Kisdorf,Schleswig-Holstein][PostCode:00000][IsGps:true]collapse is dead are trapped	1		de-DE	premium		de	DE	de-DE			00E7871B964547D1862BE1EDE9D5F954	collapse is dead are trapped	53.8011016845703	10.0746002197266	Kisdorf	Schleswig-Holstein	Germany	s:web:null	Missing form code where vertical is web and referrer is null	0	8/26/2024 1:41:40 AM	-1	0	-1	1	0	1	[{"predictions": {"en": 0.875723, "nl": 0.07648, "et": 0.042405, "ro": 0.002, "lb": 0.000966, "de": 0.000379, "nb": 0.000367, "af": 0.000288, "fr": 0.000231, "da": 0.000231}, "text": "collapse is dead are trapped"}]	"en": 0.875723, "nl": 0.07648, "et": 0.042405, "ro": 0.002, "lb": 0.000966, "de": 0.000379, "nb": 0.000367, "af": 0.000288, "fr": 0.000231, "da": 0.000231	0	de-DE	northeurope	en: 0.875723, nl: 0.07648, et: 0.042405, ro: 0.002, lb: 0.000966, de: 0.000379, nb: 0.000367, af: 0.000288, fr: 0.000231, da: 0.000231	1	1	1	0	10			1	1	10	8	0	1	de	en	Diese Suchanfrage ist vermutlich an aktuellen Webseiten interessiert. Bitte überlegen Sie, ob das Dokument aktuell genug ist, um die Bedürfnisse des Nutzers zufriedenzustellen.	Der Nutzer möchte vermutlich Dokumente, die aktuell sind. Bitte beachten Sie daher auch die Datumsangaben auf der Ergebnisseite. Gehen Sie davon aus, dass die Suchanfrage soeben erst eingegeben wurde.	f823bc67-7172-40dd-8143-d13e0f9eea04	2024-08-26T12:01:03.0000000+00:00	de-DE	0
1ecf9ccc-5068-4bb6-bb90-4fca582a666a	de-DE	[Lat:53.1870994567871][Long:8.70839977264404][Town:Ritterhude,Lower Saxony][PostCode:00000][IsGps:true]news solingen	1		de-DE	premium		de	DE	de-DE		3090C5E44A516684113FD1034B9D6703	FFA3053FA21D4DD3A9BC625625EFBB33	news solingen	53.1870994567871	8.70839977264404	Ritterhude	Lower Saxony	Germany	ANSPH1		-1	8/26/2024 12:12:01 AM	-1	58	57	4	1	1	[{"predictions": {"de": 0.483663, "en": 0.449178, "nl": 0.039634, "lb": 0.009427, "sv": 0.007463, "id": 0.004425, "es": 0.001919, "da": 0.001393, "nb": 0.000765, "ro": 0.000762}, "text": "news solingen"}]	"de": 0.483663, "en": 0.449178, "nl": 0.039634, "lb": 0.009427, "sv": 0.007463, "id": 0.004425, "es": 0.001919, "da": 0.001393, "nb": 0.000765, "ro": 0.000762	0	de-DE	northeurope	de: 0.483663, en: 0.449178, nl: 0.039634, lb: 0.009427, sv: 0.007463, id: 0.004425, es: 0.001919, da: 0.001393, nb: 0.000765, ro: 0.000762	1	1	1	0	8			1	1	8	8	1	1	de	de	Diese Suchanfrage ist vermutlich an aktuellen Webseiten interessiert. Bitte überlegen Sie, ob das Dokument aktuell genug ist, um die Bedürfnisse des Nutzers zufriedenzustellen.	Der Nutzer möchte vermutlich Dokumente, die aktuell sind. Bitte beachten Sie daher auch die Datumsangaben auf der Ergebnisseite. Gehen Sie davon aus, dass die Suchanfrage soeben erst eingegeben wurde.	f823bc67-7172-40dd-8143-d13e0f9eea04	2024-08-26T12:01:03.0000000+00:00	de-DE	0
22e487b9-b79a-43dd-98b9-0fd2e6e5567a	en-US	[Lat:41.130699157714844][Long:-73.69879913330078][Town:Armonk,New York][PostCode:00000][IsGps:true]ipo watch ipo allotment status	1		en-US	premium		en	US	en-US		2C6AB6FFC46F65CD11CBA21EC521641E	FFADE463DC2D41F8AE870D8A8B63C0B6	ipo watch ipo allotment status	41.130699157714844	-73.69879913330078	Armonk	New York	United States	ANNTA1		-1	8/26/2024 1:25:26 AM	-1	10	9	2	1	1	[{"predictions": {"en": 0.995665, "id": 0.001589, "de": 0.000607, "nl": 0.000407, "fr": 0.00034, "lb": 0.000332, "mt": 0.000266, "it": 0.000162, "sw": 0.000162, "fi": 0.000135}, "text": "ipo watch ipo allotment status"}]	"en": 0.995665, "id": 0.001589, "de": 0.000607, "nl": 0.000407, "fr": 0.00034, "lb": 0.000332, "mt": 0.000266, "it": 0.000162, "sw": 0.000162, "fi": 0.000135	1	en-US	northcentralus	en: 0.995665, id: 0.001589, de: 0.000607, nl: 0.000407, fr: 0.00034, lb: 0.000332, mt: 0.000266, it: 0.000162, sw: 0.000162, fi: 0.000135	1	1	0	0	8			1	1	8	8	1	1	en	en	This query is likely interested in recent web pages. Please think about if the document is recent enough to be a good match for the user’s needs.	The user likely wants documents that are recent. Please pay attention to dates in the Result page. Assume the query was typed in just now.	f823bc67-7172-40dd-8143-d13e0f9eea04	2024-08-26T12:01:03.0000000+00:00	en-US	0
23452f37-9191-4887-81d3-cd1c9ef3adb1	en-US	[Lat:46.9893989562988][Long:-122.688102722168][Town:Thurston Co.,WA][PostCode:00000][IsGps:true]how israelhezbollah unfolded	1		en-US	premium		en	US	en-US		03B9AB4B9CE06AE235F3BFAC9DB16BAA	005D5681C82A462FA0F437DFBB50E961	how israelhezbollah unfolded	46.9893989562988	-122.688102722168	Thurston Co.	WA	United States	s:web:null	Missing form code where vertical is web and referrer is null	0	8/26/2024 12:16:05 AM	-1	0	-1	1	0	1	[{"predictions": {"en": 0.990727, "da": 0.003044, "mt": 0.002129, "es": 0.001725, "de": 0.000604, "nb": 0.000598, "id": 0.000396, "et": 0.000241, "hu": 0.000104, "sq": 0.000103}, "text": "how israelhezbollah unfolded"}]	"en": 0.990727, "da": 0.003044, "mt": 0.002129, "es": 0.001725, "de": 0.000604, "nb": 0.000598, "id": 0.000396, "et": 0.000241, "hu": 0.000104, "sq": 0.000103	0	en-US	eastus	en: 0.990727, da: 0.003044, mt: 0.002129, es: 0.001725, de: 0.000604, nb: 0.000598, id: 0.000396, et: 0.000241, hu: 0.000104, sq: 0.000103	1	1	1	0	5			1	1	5	5	1	1	en	en	This query is likely interested in recent web pages. Please think about if the document is recent enough to be a good match for the user’s needs.	The user likely wants documents that are recent. Please pay attention to dates in the Result page. Assume the query was typed in just now.	f823bc67-7172-40dd-8143-d13e0f9eea04	2024-08-26T12:01:03.0000000+00:00	en-US	0
2514a56b-963e-4a90-b0c0-df49294139c2	es-ES	[Lat:40.447200775146484][Long:-3.7035999298095703][Town:Madrid,Community Of Madrid][PostCode:00000][IsGps:true]invitdas boda jordi cruz	1		es-ES	premium		es	ES	es-ES			FDECA0BDF6CB4ABAAF3CF74E622D9484	invitdas boda jordi cruz	40.447200775146484	-3.7035999298095703	Madrid	Community Of Madrid	Spain	ANNAB1		-1	8/26/2024 2:42:51 AM	-1	0	-1	1	1	1	[{"predictions": {"es": 0.980422, "ca": 0.016467, "pt-PT": 0.001668, "gl": 0.001172, "tr": 9.8e-05, "eu": 8.6e-05, "hu": 2.4e-05, "en": 1.8e-05, "sq": 9e-06, "sv": 8e-06}, "text": "invitdas boda jordi cruz"}]	"es": 0.980422, "ca": 0.016467, "pt-PT": 0.001668, "gl": 0.001172, "tr": 9.8e-05, "eu": 8.6e-05, "hu": 2.4e-05, "en": 1.8e-05, "sq": 9e-06, "sv": 8e-06	1	es-ES	northeurope	es: 0.980422, ca: 0.016467, pt-PT: 0.001668, gl: 0.001172, tr: 9.8E-05, eu: 8.6E-05, hu: 2.4E-05, en: 1.8E-05, sq: 9E-06, sv: 8E-06	1	1	1	0	8			1	1	8	8	0	1	es	es	Esta consulta probablemente esté enfocada en páginas web recientes. Piense si el documento es lo suficientemente reciente como para que coincida con las necesidades del usuario	Es probable que el usuario quiera documentos que sean recientes. Preste atención a las fechas en la página de resultados. Supongamos que la consulta se escribió hace un momento.	f823bc67-7172-40dd-8143-d13e0f9eea04	2024-08-26T12:01:03.0000000+00:00	es-ES	0
2532c33d-a07e-4c3b-a189-d5d615b7798b	de-DE	[Lat:51.5251998901367][Long:7.46549987792969][Town:Dortmund,North Rhine-Westphalia][PostCode:00000][IsGps:true]hackers windows entirely new way to	1		de-DE	premium		en	DE	en-GB		0014A37D71126E412046B79B70066FA9	0063C86218514E2980FF5BB7728C2D07	hackers windows entirely new way to	51.5251998901367	7.46549987792969	Dortmund	North Rhine-Westphalia	Germany	s:web:null	Missing form code where vertical is web and referrer is null	0	8/26/2024 1:14:42 AM	-1	0	-1	0	0	1	[{"predictions": {"en": 0.999932, "de": 5.8e-05, "vi": 7e-06, "nl": 1e-06}, "text": "hackers windows entirely new way to"}]	"en": 0.999932, "de": 5.8e-05, "vi": 7e-06, "nl": 1e-06	0	en-GB	northeurope	en: 0.999932, de: 5.8E-05, vi: 7E-06, nl: 1E-06	1	1	1	0	6			1	0	6	2	1	1	en	en	This query is likely interested in recent web pages. Please think about if the document is recent enough to be a good match for the user’s needs.	The user likely wants documents that are recent. Please pay attention to dates in the Result page. Assume the query was typed in just now.	f823bc67-7172-40dd-8143-d13e0f9eea04	2024-08-26T12:01:03.0000000+00:00	de-DE	0
2565f1c1-36a4-4017-8ddd-1e55227e36b6	es-ES	[Lat:40.954498291015625][Long:-5.695499897003174][Town:Salamanca,Castilla And Leon][PostCode:00000][IsGps:true]por qué se ha apalzado el partido del betis ?	1		es-ES	premium		es	ES	es-ES			016C4CCBDD7542568CE72DC7C44AF3E8	por qué se ha apalzado el partido del betis ?	40.954498291015625	-5.695499897003174	Salamanca	Castilla And Leon	Spain	BGASDF		-1	8/26/2024 1:58:08 AM	-1	0	-1	0	0	1	[{"predictions": {"es": 0.99993, "gl": 7e-05}, "text": "por qué se ha apalzado el partido del betis ?"}]	"es": 0.99993, "gl": 7e-05	1	es-ES	eastus	es: 0.99993, gl: 7E-05	1	1	0	0	6			1	1	6	5	0	1	es	es	Esta consulta probablemente esté enfocada en páginas web recientes. Piense si el documento es lo suficientemente reciente como para que coincida con las necesidades del usuario	Es probable que el usuario quiera documentos que sean recientes. Preste atención a las fechas en la página de resultados. Supongamos que la consulta se escribió hace un momento.	f823bc67-7172-40dd-8143-d13e0f9eea04	2024-08-26T12:01:03.0000000+00:00	es-ES	0
25b212b7-1087-401a-92b2-61a7783c0a1e	de-DE	[Lat:48.747501373291016][Long:11.450300216674805][Town:Ingolstadt,Bavaria][PostCode:00000][IsGps:true]red sea delivery issues	1		de-DE	premium		de	DE	de-DE			00E649D0D7BD434A93D26D43FE71AD1D	red sea delivery issues	48.747501373291016	11.450300216674805	Ingolstadt	Bavaria	Germany	ANAB01		-1	8/26/2024 2:47:53 AM	-1	0	-1	1	0	1	[{"predictions": {"en": 0.994263, "pt-PT": 0.002982, "sw": 0.000383, "et": 0.000357, "ms": 0.000313, "it": 0.000244, "da": 0.000219, "sq": 0.000187, "sv": 0.00013, "mt": 0.000125}, "text": "red sea delivery issues"}]	"en": 0.994263, "pt-PT": 0.002982, "sw": 0.000383, "et": 0.000357, "ms": 0.000313, "it": 0.000244, "da": 0.000219, "sq": 0.000187, "sv": 0.00013, "mt": 0.000125	1	de-DE	northeurope	en: 0.994263, pt-PT: 0.002982, sw: 0.000383, et: 0.000357, ms: 0.000313, it: 0.000244, da: 0.000219, sq: 0.000187, sv: 0.00013, mt: 0.000125	0	0	0	0	8			1	0	8	0	1	1	de	en	Diese Suchanfrage ist vermutlich an aktuellen Webseiten interessiert. Bitte überlegen Sie, ob das Dokument aktuell genug ist, um die Bedürfnisse des Nutzers zufriedenzustellen.	Der Nutzer möchte vermutlich Dokumente, die aktuell sind. Bitte beachten Sie daher auch die Datumsangaben auf der Ergebnisseite. Gehen Sie davon aus, dass die Suchanfrage soeben erst eingegeben wurde.	f823bc67-7172-40dd-8143-d13e0f9eea04	2024-08-26T12:01:03.0000000+00:00	de-DE	0
283f680e-e3f2-4f21-abfd-71374e0d8462	es-ES	[Lat:40.42449951171875][Long:-3.6842000484466553][Town:Madrid,Community Of Madrid][PostCode:00000][IsGps:true]movimiento sismico extremadura	1		es-ES	premium		es	ES	es-ES		2D1B4962D93A6C3A3D7D5DC6D8926DBE	FDBC92C82DB244238854338604E21A46	movimiento sismico extremadura	40.42449951171875	-3.6842000484466553	Madrid	Community Of Madrid	Spain	ANSPA1		-1	8/26/2024 12:49:45 AM	-1	0	-1	0	1	1	[{"predictions": {"es": 0.999943, "gl": 4.8e-05, "pt-PT": 7e-06}, "text": "movimiento sismico extremadura"}]	"es": 0.999943, "gl": 4.8e-05, "pt-PT": 7e-06	1	es-ES	northeurope	es: 0.999943, gl: 4.8E-05, pt-PT: 7E-06	1	1	1	0	6			1	1	6	6	1	1	es	es	Esta consulta probablemente esté enfocada en páginas web recientes. Piense si el documento es lo suficientemente reciente como para que coincida con las necesidades del usuario	Es probable que el usuario quiera documentos que sean recientes. Preste atención a las fechas en la página de resultados. Supongamos que la consulta se escribió hace un momento.	f823bc67-7172-40dd-8143-d13e0f9eea04	2024-08-26T12:01:03.0000000+00:00	es-ES	0
285e6742-b978-4f5b-b29a-532979c4de76	en-US	[Lat:33.7042007446289][Long:-93.0475006103516][Town:,][PostCode:00000][IsGps:true]deadpool and wolverine streaming release date	1		en-US	premium		en	US	en-US	40E2DF8F5BDD6F0C89939F9AFFFFFFFF	04686E67AD7161D40D417AA9AC54601B	FFA25D94F4164995903B04E7AB1CFB52	deadpool and wolverine streaming release date	33.7042007446289	-93.0475006103516				ANNTA1		-1	8/26/2024 1:23:46 AM	-1	729	728	5	1	1	[{"predictions": {"en": 0.99983, "fr": 0.000119, "nl": 2.7e-05, "da": 8e-06, "lb": 7e-06, "de": 5e-06, "ro": 2e-06}, "text": "deadpool and wolverine streaming release date"}]	"en": 0.99983, "fr": 0.000119, "nl": 2.7e-05, "da": 8e-06, "lb": 7e-06, "de": 5e-06, "ro": 2e-06	0	en-US	northcentralus	en: 0.99983, fr: 0.000119, nl: 2.7E-05, da: 8E-06, lb: 7E-06, de: 5E-06, ro: 2E-06	1	1	0	0	8			1	1	8	3	1	1	en	en	This query is likely interested in recent web pages. Please think about if the document is recent enough to be a good match for the user’s needs.	The user likely wants documents that are recent. Please pay attention to dates in the Result page. Assume the query was typed in just now.	f823bc67-7172-40dd-8143-d13e0f9eea04	2024-08-26T12:01:03.0000000+00:00	en-US	0
